aiter/configs/a8w8_tuned_gemm.csv
cu_num,M,N,K,kernelId,splitK,us,kernelName
80,1,1280,8192,34,0,21.6639,a8w8_rowwise_256x16x64x512_16x16_1x1_32x8x1_32x8x1_1x16x1x16_4x4x1_1x1_intrawave_v3
80,1,8192,1024,78,0,9.2458,a8w8_rowwise_64x16x16x128_16x16_1x1_8x8x1_8x8x1_1x16x1x4_4x4x1_1x1_interwave_v2
80,32,1280,8192,34,0,18.5951,a8w8_rowwise_256x16x64x512_16x16_1x1_32x8x1_32x8x1_1x16x1x16_4x4x1_1x1_intrawave_v3
80,32,8192,1024,28,0,10.4978,a8w8_rowwise_256x32x128x256_32x32_1x1_16x16x1_16x16x1_1x32x1x8_8x8x1_1x1_intrawave_v3
80,64,1280,8192,34,0,18.7283,a8w8_rowwise_256x16x64x512_16x16_1x1_32x8x1_32x8x1_1x16x1x16_4x4x1_1x1_intrawave_v3
80,64,8192,1024,21,0,13.2415,a8w8_rowwise_256x64x128x256_32x32_1x2_16x16x1_16x16x1_1x32x1x8_8x8x1_1x1_intrawave_v3
80,128,1280,8192,30,0,23.3627,a8w8_rowwise_256x32x64x512_16x16_1x2_32x8x1_32x8x1_1x32x1x8_8x8x1_1x2_intrawave_v3
80,128,8192,1024,45,0,20.3239,a8w8_rowwise_256x128x64x128_32x32_2x1_8x32x1_8x32x1_1x32x1x8_8x8x1_1x1_intrawave_v3
80,192,1280,8192,23,0,33.1804,a8w8_rowwise_256x64x64x512_32x32_1x1_32x8x1_32x8x1_1x32x1x8_8x8x1_1x1_intrawave_v3
80,192,8192,1024,47,0,26.4371,a8w8_rowwise_256x64x64x128_32x32_1x1_8x32x1_8x32x1_1x32x1x8_8x8x1_1x1_intrawave_v3
80,256,1280,8192,23,0,33.568,a8w8_rowwise_256x64x64x512_32x32_1x1_32x8x1_32x8x1_1x32x1x8_8x8x1_1x1_intrawave_v3
80,256,8192,1024,13,0,30.0043,a8w8_rowwise_256x128x128x128_32x32_2x2_8x32x1_8x32x1_1x32x1x8_8x8x1_1x1_intrawave_v3
80,320,1280,8192,21,0,54.7817,a8w8_rowwise_256x64x128x256_32x32_1x2_16x16x1_16x16x1_1x32x1x8_8x8x1_1x1_intrawave_v3
80,320,8192,1024,47,0,40.0412,a8w8_rowwise_256x64x64x128_32x32_1x1_8x32x1_8x32x1_1x32x1x8_8x8x1_1x1_intrawave_v3
80,512,1280,8192,21,0,55.3717,a8w8_rowwise_256x64x128x256_32x32_1x2_16x16x1_16x16x1_1x32x1x8_8x8x1_1x1_intrawave_v3
80,512,8192,1024,13,0,53.1344,a8w8_rowwise_256x128x128x128_32x32_2x2_8x32x1_8x32x1_1x32x1x8_8x8x1_1x1_intrawave_v3
80,1024,1280,8192,13,0,89.511,a8w8_rowwise_256x128x128x128_32x32_2x2_8x32x1_8x32x1_1x32x1x8_8x8x1_1x1_intrawave_v3
80,1024,8192,1024,13,0,94.821,a8w8_rowwise_256x128x128x128_32x32_2x2_8x32x1_8x32x1_1x32x1x8_8x8x1_1x1_intrawave_v3
80,2048,1280,8192,13,0,141.1901,a8w8_rowwise_256x128x128x128_32x32_2x2_8x32x1_8x32x1_1x32x1x8_8x8x1_1x1_intrawave_v3
80,2048,8192,1024,13,0,161.9182,a8w8_rowwise_256x128x128x128_32x32_2x2_8x32x1_8x32x1_1x32x1x8_8x8x1_1x1_intrawave_v3
80,4096,1280,8192,13,0,276.5091,a8w8_rowwise_256x128x128x128_32x32_2x2_8x32x1_8x32x1_1x32x1x8_8x8x1_1x1_intrawave_v3
80,4096,8192,1024,13,0,309.2924,a8w8_rowwise_256x128x128x128_32x32_2x2_8x32x1_8x32x1_1x32x1x8_8x8x1_1x1_intrawave_v3
80,8192,1280,8192,0,0,528.1318,a8w8_rowwise_256x256x256x64_32x32_4x4_4x64x1_4x64x1_1x32x1x8_8x8x1_1x1_intrawave_v4
80,8192,8192,1024,13,0,602.993,a8w8_rowwise_256x128x128x128_32x32_2x2_8x32x1_8x32x1_1x32x1x8_8x8x1_1x1_intrawave_v3
80,16384,1280,8192,0,0,1046.4171,a8w8_rowwise_256x256x256x64_32x32_4x4_4x64x1_4x64x1_1x32x1x8_8x8x1_1x1_intrawave_v4
80,16384,8192,1024,41,0,1210.4862,a8w8_rowwise_256x128x128x128_32x32_2x2_8x32x1_8x32x1_1x32x1x8_8x8x1_1x1_intrawave_v5
304,64,4096,7168,30,0,18.8358,a8w8_rowwise_256x32x64x512_16x16_1x2_32x8x1_32x8x1_1x32x1x8_8x8x1_1x2_intrawave_v3
304,64,7168,2048,30,0,11.6202,a8w8_rowwise_256x32x64x512_16x16_1x2_32x8x1_32x8x1_1x32x1x8_8x8x1_1x2_intrawave_v3
304,128,4096,7168,23,0,26.8686,a8w8_rowwise_256x64x64x512_32x32_1x1_32x8x1_32x8x1_1x32x1x8_8x8x1_1x1_intrawave_v3
304,128,7168,2048,23,0,15.4906,a8w8_rowwise_256x64x64x512_32x32_1x1_32x8x1_32x8x1_1x32x1x8_8x8x1_1x1_intrawave_v3
304,256,128,512,78,0,3.5749,a8w8_rowwise_64x16x16x128_16x16_1x1_8x8x1_8x8x1_1x16x1x4_4x4x1_1x1_interwave_v2
304,256,256,7168,34,0,12.5403,a8w8_rowwise_256x16x64x512_16x16_1x1_32x8x1_32x8x1_1x16x1x16_4x4x1_1x1_intrawave_v3
304,256,512,128,49,0,3.0049,a8w8_rowwise_64x16x16x128_16x16_1x1_8x8x1_8x8x1_1x16x1x4_4x4x1_1x1_intrawave_v1
304,256,2112,7168,23,0,25.0259,a8w8_rowwise_256x64x64x512_32x32_1x1_32x8x1_32x8x1_1x32x1x8_8x8x1_1x1_intrawave_v3
304,256,4096,7168,23,0,37.1143,a8w8_rowwise_256x64x64x512_32x32_1x1_32x8x1_32x8x1_1x32x1x8_8x8x1_1x1_intrawave_v3
304,256,7168,2048,15,0,22.3786,a8w8_rowwise_256x128x64x256_32x32_2x1_16x16x1_16x16x1_1x32x1x8_8x8x1_1x1_intrawave_v3
304,256,7168,16384,21,0,115.8521,a8w8_rowwise_256x64x128x256_32x32_1x2_16x16x1_16x16x1_1x32x1x8_8x8x1_1x1_intrawave_v3
304,256,24576,1536,13,0,46.7269,a8w8_rowwise_256x128x128x128_32x32_2x2_8x32x1_8x32x1_1x32x1x8_8x8x1_1x1_intrawave_v3
304,500,128,512,78,0,3.7674,a8w8_rowwise_64x16x16x128_16x16_1x1_8x8x1_8x8x1_1x16x1x4_4x4x1_1x1_interwave_v2
304,500,256,7168,34,0,14.8999,a8w8_rowwise_256x16x64x512_16x16_1x1_32x8x1_32x8x1_1x16x1x16_4x4x1_1x1_intrawave_v3
304,500,512,128,69,0,3.1746,a8w8_rowwise_128x16x32x128_16x16_1x1_8x16x1_8x16x1_1x16x1x8_4x4x1_1x1_interwave_v1
304,500,2112,7168,23,0,37.7458,a8w8_rowwise_256x64x64x512_32x32_1x1_32x8x1_32x8x1_1x32x1x8_8x8x1_1x1_intrawave_v3
304,500,4096,7168,21,0,60.0357,a8w8_rowwise_256x64x128x256_32x32_1x2_16x16x1_16x16x1_1x32x1x8_8x8x1_1x1_intrawave_v3
304,500,7168,2048,13,0,35.2296,a8w8_rowwise_256x128x128x128_32x32_2x2_8x32x1_8x32x1_1x32x1x8_8x8x1_1x1_intrawave_v3
304,500,7168,16384,13,0,182.1725,a8w8_rowwise_256x128x128x128_32x32_2x2_8x32x1_8x32x1_1x32x1x8_8x8x1_1x1_intrawave_v3
304,500,24576,1536,3,0,67.2381,a8w8_rowwise_256x256x192x128_32x32_4x3_8x32x1_8x32x1_1x32x1x8_8x8x1_1x1_intrawave_v3
304,512,128,512,79,0,3.6421,a8w8_rowwise_128x16x32x128_16x16_1x1_8x16x1_8x16x1_1x16x1x8_4x4x1_1x1_interwave_v2
304,512,256,7168,34,0,12.8647,a8w8_rowwise_256x16x64x512_16x16_1x1_32x8x1_32x8x1_1x16x1x16_4x4x1_1x1_intrawave_v3
304,512,512,128,49,0,3.2045,a8w8_rowwise_64x16x16x128_16x16_1x1_8x8x1_8x8x1_1x16x1x4_4x4x1_1x1_intrawave_v1
304,512,2112,7168,23,0,38.2825,a8w8_rowwise_256x64x64x512_32x32_1x1_32x8x1_32x8x1_1x32x1x8_8x8x1_1x1_intrawave_v3
304,512,4096,7168,21,0,58.0365,a8w8_rowwise_256x64x128x256_32x32_1x2_16x16x1_16x16x1_1x32x1x8_8x8x1_1x1_intrawave_v3
304,512,7168,2048,13,0,33.589,a8w8_rowwise_256x128x128x128_32x32_2x2_8x32x1_8x32x1_1x32x1x8_8x8x1_1x1_intrawave_v3
304,512,7168,16384,13,0,182.0027,a8w8_rowwise_256x128x128x128_32x32_2x2_8x32x1_8x32x1_1x32x1x8_8x8x1_1x1_intrawave_v3
304,512,24576,1536,3,0,67.7278,a8w8_rowwise_256x256x192x128_32x32_4x3_8x32x1_8x32x1_1x32x1x8_8x8x1_1x1_intrawave_v3
304,544,128,512,78,0,3.5987,a8w8_rowwise_64x16x16x128_16x16_1x1_8x8x1_8x8x1_1x16x1x4_4x4x1_1x1_interwave_v2
304,544,256,7168,34,0,12.7617,a8w8_rowwise_256x16x64x512_16x16_1x1_32x8x1_32x8x1_1x16x1x16_4x4x1_1x1_intrawave_v3
304,544,512,128,50,0,3.1987,a8w8_rowwise_128x16x32x128_16x16_1x1_8x16x1_8x16x1_1x16x1x8_4x4x1_1x1_intrawave_v1
304,544,2112,7168,23,0,42.8268,a8w8_rowwise_256x64x64x512_32x32_1x1_32x8x1_32x8x1_1x32x1x8_8x8x1_1x1_intrawave_v3
304,544,4096,7168,21,0,64.0705,a8w8_rowwise_256x64x128x256_32x32_1x2_16x16x1_16x16x1_1x32x1x8_8x8x1_1x1_intrawave_v3
304,544,7168,2048,13,0,38.0339,a8w8_rowwise_256x128x128x128_32x32_2x2_8x32x1_8x32x1_1x32x1x8_8x8x1_1x1_intrawave_v3
304,544,7168,16384,13,0,201.1097,a8w8_rowwise_256x128x128x128_32x32_2x2_8x32x1_8x32x1_1x32x1x8_8x8x1_1x1_intrawave_v3
304,544,24576,1536,1,0,81.048,a8w8_rowwise_256x256x256x128_32x32_4x4_8x32x1_8x32x1_1x32x1x8_8x8x1_1x1_intrawave_v3
