aiter/configs/a8w8_blockscale_tuned_gemm_bruteforce_ver1.csv
cu_num,M,N,K,kernelId,splitK,us,kernelName
304,1,256,7168,234,2,12.5134,a8w8_blockscale_1x128x128_256x32x32x512_16x16_16x16_32x8x1_32x8x1_1x32x1x8_4_1x1_intrawave_v1
304,1,512,7168,195,1,14.3586,a8w8_blockscale_1x128x128_256x32x32x512_16x16_16x16_16x16x1_16x16x1_1x32x1x8_4_1x1_intrawave_v1
304,1,576,7168,234,1,14.2966,a8w8_blockscale_1x128x128_256x32x32x512_16x16_16x16_32x8x1_32x8x1_1x32x1x8_4_1x1_intrawave_v1
304,1,1536,1536,234,3,5.312,a8w8_blockscale_1x128x128_256x32x32x512_16x16_16x16_32x8x1_32x8x1_1x32x1x8_4_1x1_intrawave_v1
304,1,1536,7168,195,2,14.6926,a8w8_blockscale_1x128x128_256x32x32x512_16x16_16x16_16x16x1_16x16x1_1x32x1x8_4_1x1_intrawave_v1
304,1,1536,8192,234,2,16.2608,a8w8_blockscale_1x128x128_256x32x32x512_16x16_16x16_32x8x1_32x8x1_1x32x1x8_4_1x1_intrawave_v1
304,1,3072,1536,234,1,6.2443,a8w8_blockscale_1x128x128_256x32x32x512_16x16_16x16_32x8x1_32x8x1_1x32x1x8_4_1x1_intrawave_v1
304,1,4096,512,135,3,3.9254,a8w8_blockscale_1x128x128_256x32x32x256_16x16_16x16_8x32x1_8x32x1_1x32x1x8_4_1x1_intrawave_v1
304,1,4608,7168,234,3,15.2142,a8w8_blockscale_1x128x128_256x32x32x512_16x16_16x16_32x8x1_32x8x1_1x32x1x8_4_1x1_intrawave_v1
304,1,7168,256,130,1,3.611,a8w8_blockscale_1x128x128_256x32x32x128_16x16_16x16_8x32x1_8x32x1_1x32x1x8_4_1x1_intrawave_v1
304,1,7168,2048,21,0,9.4127,a8w8_blockscale_1x128x128_256x16x64x512_16x16_16x16_16x16x1_16x16x1_1x16x1x16_4_1x1_intrawave_v1
304,1,7168,2304,195,3,9.0623,a8w8_blockscale_1x128x128_256x32x32x512_16x16_16x16_16x16x1_16x16x1_1x32x1x8_4_1x1_intrawave_v1
304,1,8192,1536,195,3,7.4937,a8w8_blockscale_1x128x128_256x32x32x512_16x16_16x16_16x16x1_16x16x1_1x32x1x8_4_1x1_intrawave_v1
304,1,8192,7168,44,3,20.2493,a8w8_blockscale_1x128x128_256x16x64x512_16x16_16x16_32x8x1_32x8x1_1x16x1x16_4_1x1_intrawave_v1
304,1,8192,8192,21,2,27.3888,a8w8_blockscale_1x128x128_256x16x64x512_16x16_16x16_16x16x1_16x16x1_1x16x1x16_4_1x1_intrawave_v1
304,2,512,7168,195,1,14.3269,a8w8_blockscale_1x128x128_256x32x32x512_16x16_16x16_16x16x1_16x16x1_1x32x1x8_4_1x1_intrawave_v1
304,2,1536,7168,195,2,14.8356,a8w8_blockscale_1x128x128_256x32x32x512_16x16_16x16_16x16x1_16x16x1_1x32x1x8_4_1x1_intrawave_v1
304,2,1536,8192,234,2,15.7344,a8w8_blockscale_1x128x128_256x32x32x512_16x16_16x16_32x8x1_32x8x1_1x32x1x8_4_1x1_intrawave_v1
304,2,3072,1536,234,0,5.8464,a8w8_blockscale_1x128x128_256x32x32x512_16x16_16x16_32x8x1_32x8x1_1x32x1x8_4_1x1_intrawave_v1
304,2,4096,512,135,0,3.4333,a8w8_blockscale_1x128x128_256x32x32x256_16x16_16x16_8x32x1_8x32x1_1x32x1x8_4_1x1_intrawave_v1
304,2,4608,7168,195,2,14.7484,a8w8_blockscale_1x128x128_256x32x32x512_16x16_16x16_16x16x1_16x16x1_1x32x1x8_4_1x1_intrawave_v1
304,2,7168,256,135,3,3.6324,a8w8_blockscale_1x128x128_256x32x32x256_16x16_16x16_8x32x1_8x32x1_1x32x1x8_4_1x1_intrawave_v1
304,2,7168,2048,27,2,9.309,a8w8_blockscale_1x128x128_256x16x64x512_16x16_16x16_16x16x1_32x8x1_1x16x1x16_4_1x1_intrawave_v1
304,2,7168,2304,195,2,9.0554,a8w8_blockscale_1x128x128_256x32x32x512_16x16_16x16_16x16x1_16x16x1_1x32x1x8_4_1x1_intrawave_v1
304,2,8192,1536,195,1,7.1925,a8w8_blockscale_1x128x128_256x32x32x512_16x16_16x16_16x16x1_16x16x1_1x32x1x8_4_1x1_intrawave_v1
304,2,8192,7168,27,1,20.6322,a8w8_blockscale_1x128x128_256x16x64x512_16x16_16x16_16x16x1_32x8x1_1x16x1x16_4_1x1_intrawave_v1
304,4,512,7168,205,3,14.6,a8w8_blockscale_1x128x128_256x32x32x512_16x16_16x16_16x16x1_32x8x1_1x32x1x8_4_1x1_intrawave_v1
304,4,1536,7168,234,1,15.022,a8w8_blockscale_1x128x128_256x32x32x512_16x16_16x16_32x8x1_32x8x1_1x32x1x8_4_1x1_intrawave_v1
304,4,1536,8192,195,3,16.0056,a8w8_blockscale_1x128x128_256x32x32x512_16x16_16x16_16x16x1_16x16x1_1x32x1x8_4_1x1_intrawave_v1
304,4,3072,1536,195,3,5.8388,a8w8_blockscale_1x128x128_256x32x32x512_16x16_16x16_16x16x1_16x16x1_1x32x1x8_4_1x1_intrawave_v1
304,4,4096,512,135,3,3.9461,a8w8_blockscale_1x128x128_256x32x32x256_16x16_16x16_8x32x1_8x32x1_1x32x1x8_4_1x1_intrawave_v1
304,4,4608,7168,195,1,14.7356,a8w8_blockscale_1x128x128_256x32x32x512_16x16_16x16_16x16x1_16x16x1_1x32x1x8_4_1x1_intrawave_v1
304,4,7168,256,130,0,3.0632,a8w8_blockscale_1x128x128_256x32x32x128_16x16_16x16_8x32x1_8x32x1_1x32x1x8_4_1x1_intrawave_v1
304,4,7168,2048,21,3,9.0015,a8w8_blockscale_1x128x128_256x16x64x512_16x16_16x16_16x16x1_16x16x1_1x16x1x16_4_1x1_intrawave_v1
304,4,7168,2304,195,3,9.1366,a8w8_blockscale_1x128x128_256x32x32x512_16x16_16x16_16x16x1_16x16x1_1x32x1x8_4_1x1_intrawave_v1
304,4,8192,1536,195,1,7.4781,a8w8_blockscale_1x128x128_256x32x32x512_16x16_16x16_16x16x1_16x16x1_1x32x1x8_4_1x1_intrawave_v1
304,4,8192,7168,44,1,20.6144,a8w8_blockscale_1x128x128_256x16x64x512_16x16_16x16_32x8x1_32x8x1_1x16x1x16_4_1x1_intrawave_v1
304,8,256,7168,234,2,13.2286,a8w8_blockscale_1x128x128_256x32x32x512_16x16_16x16_32x8x1_32x8x1_1x32x1x8_4_1x1_intrawave_v1
304,8,512,7168,195,0,14.1486,a8w8_blockscale_1x128x128_256x32x32x512_16x16_16x16_16x16x1_16x16x1_1x32x1x8_4_1x1_intrawave_v1
304,8,576,7168,205,0,14.5529,a8w8_blockscale_1x128x128_256x32x32x512_16x16_16x16_16x16x1_32x8x1_1x32x1x8_4_1x1_intrawave_v1
304,8,1536,7168,195,1,15.2721,a8w8_blockscale_1x128x128_256x32x32x512_16x16_16x16_16x16x1_16x16x1_1x32x1x8_4_1x1_intrawave_v1
304,8,1536,8192,234,0,16.1108,a8w8_blockscale_1x128x128_256x32x32x512_16x16_16x16_32x8x1_32x8x1_1x32x1x8_4_1x1_intrawave_v1
304,8,3072,1536,195,3,6.2376,a8w8_blockscale_1x128x128_256x32x32x512_16x16_16x16_16x16x1_16x16x1_1x32x1x8_4_1x1_intrawave_v1
304,8,4096,512,135,1,3.4277,a8w8_blockscale_1x128x128_256x32x32x256_16x16_16x16_8x32x1_8x32x1_1x32x1x8_4_1x1_intrawave_v1
304,8,4608,7168,205,0,14.9773,a8w8_blockscale_1x128x128_256x32x32x512_16x16_16x16_16x16x1_32x8x1_1x32x1x8_4_1x1_intrawave_v1
304,8,7168,256,130,2,3.0697,a8w8_blockscale_1x128x128_256x32x32x128_16x16_16x16_8x32x1_8x32x1_1x32x1x8_4_1x1_intrawave_v1
304,8,7168,2048,21,3,9.4683,a8w8_blockscale_1x128x128_256x16x64x512_16x16_16x16_16x16x1_16x16x1_1x16x1x16_4_1x1_intrawave_v1
304,8,7168,2304,195,0,9.1947,a8w8_blockscale_1x128x128_256x32x32x512_16x16_16x16_16x16x1_16x16x1_1x32x1x8_4_1x1_intrawave_v1
304,8,8192,1536,195,1,7.2449,a8w8_blockscale_1x128x128_256x32x32x512_16x16_16x16_16x16x1_16x16x1_1x32x1x8_4_1x1_intrawave_v1
304,8,8192,7168,44,0,21.0997,a8w8_blockscale_1x128x128_256x16x64x512_16x16_16x16_32x8x1_32x8x1_1x16x1x16_4_1x1_intrawave_v1
304,16,256,7168,27,0,11.6101,a8w8_blockscale_1x128x128_256x16x64x512_16x16_16x16_16x16x1_32x8x1_1x16x1x16_4_1x1_intrawave_v1
304,16,512,7168,44,1,13.3745,a8w8_blockscale_1x128x128_256x16x64x512_16x16_16x16_32x8x1_32x8x1_1x16x1x16_4_1x1_intrawave_v1
304,16,576,7168,44,1,13.3297,a8w8_blockscale_1x128x128_256x16x64x512_16x16_16x16_32x8x1_32x8x1_1x16x1x16_4_1x1_intrawave_v1
304,16,1536,7168,44,0,13.7125,a8w8_blockscale_1x128x128_256x16x64x512_16x16_16x16_32x8x1_32x8x1_1x16x1x16_4_1x1_intrawave_v1
304,16,1536,8192,44,3,15.1392,a8w8_blockscale_1x128x128_256x16x64x512_16x16_16x16_32x8x1_32x8x1_1x16x1x16_4_1x1_intrawave_v1
304,16,3072,1536,44,0,6.1675,a8w8_blockscale_1x128x128_256x16x64x512_16x16_16x16_32x8x1_32x8x1_1x16x1x16_4_1x1_intrawave_v1
304,16,4096,512,27,1,3.4522,a8w8_blockscale_1x128x128_256x16x64x512_16x16_16x16_16x16x1_32x8x1_1x16x1x16_4_1x1_intrawave_v1
304,16,4608,7168,44,0,14.0233,a8w8_blockscale_1x128x128_256x16x64x512_16x16_16x16_32x8x1_32x8x1_1x16x1x16_4_1x1_intrawave_v1
304,16,7168,256,124,3,3.5983,a8w8_blockscale_1x128x128_256x32x32x128_8x8_16x16_8x32x1_8x32x1_1x32x1x8_4_1x1_intrawave_v1
304,16,7168,2048,25,3,8.9976,a8w8_blockscale_1x128x128_256x16x64x512_8x16_16x16_16x16x1_32x8x1_1x16x1x16_4_1x1_intrawave_v1
304,16,7168,2304,234,0,8.8192,a8w8_blockscale_1x128x128_256x32x32x512_16x16_16x16_32x8x1_32x8x1_1x32x1x8_4_1x1_intrawave_v1
304,16,8192,1536,195,0,7.2441,a8w8_blockscale_1x128x128_256x32x32x512_16x16_16x16_16x16x1_16x16x1_1x32x1x8_4_1x1_intrawave_v1
304,16,8192,7168,42,1,19.294,a8w8_blockscale_1x128x128_256x16x64x512_8x16_16x16_32x8x1_32x8x1_1x16x1x16_4_1x1_intrawave_v1
304,25,256,7168,234,3,12.7327,a8w8_blockscale_1x128x128_256x32x32x512_16x16_16x16_32x8x1_32x8x1_1x32x1x8_4_1x1_intrawave_v1
304,25,512,7168,205,1,14.2759,a8w8_blockscale_1x128x128_256x32x32x512_16x16_16x16_16x16x1_32x8x1_1x32x1x8_4_1x1_intrawave_v1
304,25,576,7168,234,1,14.1104,a8w8_blockscale_1x128x128_256x32x32x512_16x16_16x16_32x8x1_32x8x1_1x32x1x8_4_1x1_intrawave_v1
304,25,1536,7168,234,3,14.5604,a8w8_blockscale_1x128x128_256x32x32x512_16x16_16x16_32x8x1_32x8x1_1x32x1x8_4_1x1_intrawave_v1
304,25,3072,1536,234,2,5.8984,a8w8_blockscale_1x128x128_256x32x32x512_16x16_16x16_32x8x1_32x8x1_1x32x1x8_4_1x1_intrawave_v1
304,25,4096,512,191,1,4.0011,a8w8_blockscale_1x128x128_256x32x32x256_16x16_16x16_16x16x1_16x16x1_1x32x1x8_4_1x1_intrawave_v1
304,25,4608,7168,195,1,14.9492,a8w8_blockscale_1x128x128_256x32x32x512_16x16_16x16_16x16x1_16x16x1_1x32x1x8_4_1x1_intrawave_v1
304,25,7168,256,135,0,3.1212,a8w8_blockscale_1x128x128_256x32x32x256_16x16_16x16_8x32x1_8x32x1_1x32x1x8_4_1x1_intrawave_v1
304,25,7168,2048,44,1,9.1482,a8w8_blockscale_1x128x128_256x16x64x512_16x16_16x16_32x8x1_32x8x1_1x16x1x16_4_1x1_intrawave_v1
304,25,7168,2304,195,0,9.2622,a8w8_blockscale_1x128x128_256x32x32x512_16x16_16x16_16x16x1_16x16x1_1x32x1x8_4_1x1_intrawave_v1
304,32,256,7168,234,0,10.8197,a8w8_blockscale_1x128x128_256x32x32x512_16x16_16x16_32x8x1_32x8x1_1x32x1x8_4_1x1_intrawave_v1
304,32,512,7168,195,1,12.3689,a8w8_blockscale_1x128x128_256x32x32x512_16x16_16x16_16x16x1_16x16x1_1x32x1x8_4_1x1_intrawave_v1
304,32,576,7168,234,2,12.3633,a8w8_blockscale_1x128x128_256x32x32x512_16x16_16x16_32x8x1_32x8x1_1x32x1x8_4_1x1_intrawave_v1
304,32,1536,7168,234,0,12.8341,a8w8_blockscale_1x128x128_256x32x32x512_16x16_16x16_32x8x1_32x8x1_1x32x1x8_4_1x1_intrawave_v1
304,32,1536,8192,195,3,14.2564,a8w8_blockscale_1x128x128_256x32x32x512_16x16_16x16_16x16x1_16x16x1_1x32x1x8_4_1x1_intrawave_v1
304,32,3072,1536,195,0,5.5004,a8w8_blockscale_1x128x128_256x32x32x512_16x16_16x16_16x16x1_16x16x1_1x32x1x8_4_1x1_intrawave_v1
304,32,4096,512,205,0,3.9863,a8w8_blockscale_1x128x128_256x32x32x512_16x16_16x16_16x16x1_32x8x1_1x32x1x8_4_1x1_intrawave_v1
304,32,4608,7168,153,2,14.573,a8w8_blockscale_1x128x128_256x32x32x512_8x16_16x16_8x32x1_16x16x1_1x32x1x8_4_1x1_intrawave_v1
304,32,7168,256,149,0,3.0995,a8w8_blockscale_1x128x128_256x32x32x256_8x16_16x16_8x32x1_16x16x1_1x32x1x8_4_1x1_intrawave_v1
304,32,7168,2048,44,2,8.4572,a8w8_blockscale_1x128x128_256x16x64x512_16x16_16x16_32x8x1_32x8x1_1x16x1x16_4_1x1_intrawave_v1
304,32,7168,2304,234,0,8.8473,a8w8_blockscale_1x128x128_256x32x32x512_16x16_16x16_32x8x1_32x8x1_1x32x1x8_4_1x1_intrawave_v1
304,32,8192,1536,195,0,7.2705,a8w8_blockscale_1x128x128_256x32x32x512_16x16_16x16_16x16x1_16x16x1_1x32x1x8_4_1x1_intrawave_v1
304,32,8192,7168,329,0,23.1173,a8w8_blockscale_1x128x128_256x32x64x512_8x16_16x16_8x32x1_32x8x1_1x16x1x16_4_1x2_intrawave_v1
304,64,256,7168,234,0,11.7341,a8w8_blockscale_1x128x128_256x32x32x512_16x16_16x16_32x8x1_32x8x1_1x32x1x8_4_1x1_intrawave_v1
304,64,512,7168,195,0,12.9937,a8w8_blockscale_1x128x128_256x32x32x512_16x16_16x16_16x16x1_16x16x1_1x32x1x8_4_1x1_intrawave_v1
304,64,576,7168,195,3,12.5481,a8w8_blockscale_1x128x128_256x32x32x512_16x16_16x16_16x16x1_16x16x1_1x32x1x8_4_1x1_intrawave_v1
304,64,1536,7168,234,0,13.5793,a8w8_blockscale_1x128x128_256x32x32x512_16x16_16x16_32x8x1_32x8x1_1x32x1x8_4_1x1_intrawave_v1
304,64,1536,8192,234,2,14.6879,a8w8_blockscale_1x128x128_256x32x32x512_16x16_16x16_32x8x1_32x8x1_1x32x1x8_4_1x1_intrawave_v1
304,64,3072,1536,195,2,6.156,a8w8_blockscale_1x128x128_256x32x32x512_16x16_16x16_16x16x1_16x16x1_1x32x1x8_4_1x1_intrawave_v1
304,64,4096,512,234,0,4.3279,a8w8_blockscale_1x128x128_256x32x32x512_16x16_16x16_32x8x1_32x8x1_1x32x1x8_4_1x1_intrawave_v1
304,64,4096,7168,427,3,16.3569,a8w8_blockscale_1x128x128_256x32x64x512_16x16_16x16_16x16x1_32x8x1_1x32x1x8_8_1x2_intrawave_v1
304,64,4608,7168,415,3,19.2002,a8w8_blockscale_1x128x128_256x32x64x512_16x16_16x16_16x16x1_32x8x1_1x16x1x16_4_1x2_intrawave_v1
304,64,7168,256,1750,3,3.9159,a8w8_blockscale_1x128x128_256x64x32x128_16x8_16x16_8x32x1_8x32x1_1x32x1x8_4_1x2_intrawave_v1
304,64,7168,2048,468,2,9.3304,a8w8_blockscale_1x128x128_256x32x64x512_16x16_16x16_32x8x1_32x8x1_1x16x1x16_4_1x2_intrawave_v1
304,64,7168,2304,1787,1,10.596,a8w8_blockscale_1x128x128_256x64x32x256_16x16_16x16_16x16x1_8x32x1_1x32x1x8_4_1x2_intrawave_v1
304,64,8192,1536,1773,1,8.6364,a8w8_blockscale_1x128x128_256x64x32x512_16x16_16x16_8x32x1_16x16x1_1x32x1x8_4_1x2_intrawave_v1
304,64,8192,7168,477,0,29.5925,a8w8_blockscale_1x128x128_256x32x64x512_16x16_16x16_32x8x1_32x8x1_1x32x1x8_4_1x1_intrawave_v1
304,72,4096,7168,415,1,21.4874,a8w8_blockscale_1x128x128_256x32x64x512_16x16_16x16_16x16x1_32x8x1_1x16x1x16_4_1x2_intrawave_v1
304,72,7168,2048,1997,0,12.5438,a8w8_blockscale_1x128x128_256x64x64x256_16x16_16x16_8x32x1_8x32x1_1x16x1x16_4_1x4_intrawave_v1
304,80,4096,7168,427,1,21.3136,a8w8_blockscale_1x128x128_256x32x64x512_16x16_16x16_16x16x1_32x8x1_1x32x1x8_8_1x2_intrawave_v1
304,80,7168,2048,2027,1,12.9385,a8w8_blockscale_1x128x128_256x64x64x256_16x16_16x16_8x32x1_8x32x1_1x32x1x8_8_1x4_intrawave_v1
304,88,4096,7168,427,1,21.6267,a8w8_blockscale_1x128x128_256x32x64x512_16x16_16x16_16x16x1_32x8x1_1x32x1x8_8_1x2_intrawave_v1
304,88,7168,2048,2062,1,13.5056,a8w8_blockscale_1x128x128_256x64x64x256_16x16_16x16_8x32x1_16x16x1_1x32x1x8_4_1x2_intrawave_v1
304,96,4096,7168,451,0,20.9963,a8w8_blockscale_1x128x128_256x32x64x512_16x16_16x16_32x8x1_16x16x1_1x16x1x16_4_1x2_intrawave_v1
304,96,7168,2048,922,0,13.182,a8w8_blockscale_1x128x128_256x32x128x256_16x16_16x16_16x16x1_16x16x1_1x16x1x16_8_1x4_intrawave_v1
304,104,4096,7168,451,2,25.4568,a8w8_blockscale_1x128x128_256x32x64x512_16x16_16x16_32x8x1_16x16x1_1x16x1x16_4_1x2_intrawave_v1
304,104,7168,2048,1997,1,13.3756,a8w8_blockscale_1x128x128_256x64x64x256_16x16_16x16_8x32x1_8x32x1_1x16x1x16_4_1x4_intrawave_v1
304,112,4096,7168,415,1,25.1523,a8w8_blockscale_1x128x128_256x32x64x512_16x16_16x16_16x16x1_32x8x1_1x16x1x16_4_1x2_intrawave_v1
304,112,7168,2048,2027,0,13.5373,a8w8_blockscale_1x128x128_256x64x64x256_16x16_16x16_8x32x1_8x32x1_1x32x1x8_8_1x4_intrawave_v1
304,120,4096,7168,409,2,27.1711,a8w8_blockscale_1x128x128_256x32x64x512_16x16_16x16_16x16x1_16x16x1_1x32x1x8_8_1x2_intrawave_v1
304,120,7168,2048,2027,2,13.8547,a8w8_blockscale_1x128x128_256x64x64x256_16x16_16x16_8x32x1_8x32x1_1x32x1x8_8_1x4_intrawave_v1
304,128,512,7168,195,1,12.8281,a8w8_blockscale_1x128x128_256x32x32x512_16x16_16x16_16x16x1_16x16x1_1x32x1x8_4_1x1_intrawave_v1
304,128,1536,7168,195,0,14.4269,a8w8_blockscale_1x128x128_256x32x32x512_16x16_16x16_16x16x1_16x16x1_1x32x1x8_4_1x1_intrawave_v1
304,128,1536,8192,205,2,15.1826,a8w8_blockscale_1x128x128_256x32x32x512_16x16_16x16_16x16x1_32x8x1_1x32x1x8_4_1x1_intrawave_v1
304,128,3072,1536,468,3,7.1543,a8w8_blockscale_1x128x128_256x32x64x512_16x16_16x16_32x8x1_32x8x1_1x16x1x16_4_1x2_intrawave_v1
304,128,4096,512,234,3,5.3248,a8w8_blockscale_1x128x128_256x32x32x512_16x16_16x16_32x8x1_32x8x1_1x32x1x8_4_1x1_intrawave_v1
304,128,4096,7168,415,3,25.9899,a8w8_blockscale_1x128x128_256x32x64x512_16x16_16x16_16x16x1_32x8x1_1x16x1x16_4_1x2_intrawave_v1
304,128,4608,7168,415,0,27.6729,a8w8_blockscale_1x128x128_256x32x64x512_16x16_16x16_16x16x1_32x8x1_1x16x1x16_4_1x2_intrawave_v1
304,128,7168,256,174,3,4.8636,a8w8_blockscale_1x128x128_256x32x32x256_8x8_16x16_16x16x1_8x32x1_1x32x1x8_4_1x1_intrawave_v1
304,128,7168,2048,1997,2,13.5901,a8w8_blockscale_1x128x128_256x64x64x256_16x16_16x16_8x32x1_8x32x1_1x16x1x16_4_1x4_intrawave_v1
304,128,7168,2304,3204,2,14.5091,a8w8_blockscale_1x128x128_256x64x64x256_16x16_32x32_16x16x1_16x16x1_1x16x1x16_4_1x1_intrawave_v1
304,128,8192,1536,2518,1,12.022,a8w8_blockscale_1x128x128_256x64x64x256_16x16_16x16_16x16x1_16x16x1_1x16x1x16_4_2x2_intrawave_v1
304,128,8192,7168,3204,2,39.8981,a8w8_blockscale_1x128x128_256x64x64x256_16x16_32x32_16x16x1_16x16x1_1x16x1x16_4_1x1_intrawave_v1
304,136,4096,7168,3204,2,30.8686,a8w8_blockscale_1x128x128_256x64x64x256_16x16_32x32_16x16x1_16x16x1_1x16x1x16_4_1x1_intrawave_v1
304,136,7168,2048,1214,3,17.7052,a8w8_blockscale_1x128x128_256x32x128x256_16x16_16x16_16x16x1_8x32x1_1x16x1x16_8_2x2_intrawave_v1
304,256,128,512,234,3,4.0335,a8w8_blockscale_1x128x128_256x32x32x512_16x16_16x16_32x8x1_32x8x1_1x32x1x8_4_1x1_intrawave_v1
304,256,256,7168,234,3,12.3125,a8w8_blockscale_1x128x128_256x32x32x512_16x16_16x16_32x8x1_32x8x1_1x32x1x8_4_1x1_intrawave_v1
304,256,512,128,124,0,3.5196,a8w8_blockscale_1x128x128_256x32x32x128_8x8_16x16_8x32x1_8x32x1_1x32x1x8_4_1x1_intrawave_v1
304,256,512,7168,234,0,12.7401,a8w8_blockscale_1x128x128_256x32x32x512_16x16_16x16_32x8x1_32x8x1_1x32x1x8_4_1x1_intrawave_v1
304,256,1536,7168,1824,0,19.0964,a8w8_blockscale_1x128x128_256x64x32x512_16x16_16x16_32x8x1_32x8x1_1x32x1x8_4_1x2_intrawave_v1
304,256,1536,8192,1824,0,20.8639,a8w8_blockscale_1x128x128_256x64x32x512_16x16_16x16_32x8x1_32x8x1_1x32x1x8_4_1x2_intrawave_v1
304,256,2112,7168,1824,3,24.2828,a8w8_blockscale_1x128x128_256x64x32x512_16x16_16x16_32x8x1_32x8x1_1x32x1x8_4_1x2_intrawave_v1
304,256,3072,1536,2131,0,9.7198,a8w8_blockscale_1x128x128_256x64x64x256_16x16_16x16_16x16x1_16x16x1_1x16x1x16_4_1x4_intrawave_v1
304,256,4096,512,295,2,6.5375,a8w8_blockscale_1x128x128_256x32x64x256_8x16_16x16_8x32x1_16x16x1_1x16x1x16_4_1x2_intrawave_v1
304,256,4096,7168,3214,3,35.6877,a8w8_blockscale_1x128x128_256x64x64x256_16x16_32x32_16x16x1_16x16x1_1x32x1x8_8_1x1_intrawave_v1
304,256,4608,7168,2131,3,37.4559,a8w8_blockscale_1x128x128_256x64x64x256_16x16_16x16_16x16x1_16x16x1_1x16x1x16_4_1x4_intrawave_v1
304,256,7168,256,246,3,5.9936,a8w8_blockscale_1x128x128_256x32x64x128_16x16_16x16_8x32x1_8x32x1_1x16x1x16_4_1x2_intrawave_v1
304,256,7168,2048,3269,1,22.8878,a8w8_blockscale_1x128x128_256x64x128x128_8x16_16x16_8x32x1_8x32x1_1x16x1x16_4_1x4_intrawave_v3
304,256,7168,2304,3414,0,21.6115,a8w8_blockscale_1x128x128_256x64x128x128_16x16_16x16_8x32x1_8x32x1_1x8x1x32_4_2x4_intrawave_v3
304,256,7168,16384,2146,3,126.2583,a8w8_blockscale_1x128x128_256x64x64x256_16x16_16x16_16x16x1_16x16x1_1x32x1x8_4_1x2_intrawave_v1
304,256,8192,1536,2518,3,18.7134,a8w8_blockscale_1x128x128_256x64x64x256_16x16_16x16_16x16x1_16x16x1_1x16x1x16_4_2x2_intrawave_v1
304,256,8192,7168,6842,0,71.1779,a8w8_blockscale_1x128x128_256x128x64x256_16x16_32x32_16x16x1_16x16x1_1x16x1x16_4_1x2_intrawave_v1
304,256,24576,1536,5875,3,47.3367,a8w8_blockscale_1x128x128_256x128x64x128_16x8_16x16_8x32x1_8x32x1_1x16x1x16_4_1x4_intrawave_v3
304,288,128,512,234,1,3.9506,a8w8_blockscale_1x128x128_256x32x32x512_16x16_16x16_32x8x1_32x8x1_1x32x1x8_4_1x1_intrawave_v1
304,288,256,7168,234,3,12.3722,a8w8_blockscale_1x128x128_256x32x32x512_16x16_16x16_32x8x1_32x8x1_1x32x1x8_4_1x1_intrawave_v1
304,288,512,128,124,3,3.5366,a8w8_blockscale_1x128x128_256x32x32x128_8x8_16x16_8x32x1_8x32x1_1x32x1x8_4_1x1_intrawave_v1
304,288,2112,7168,426,3,26.9862,a8w8_blockscale_1x128x128_256x32x64x512_16x16_16x16_16x16x1_32x8x1_1x32x1x8_4_1x1_intrawave_v1
304,288,4096,7168,1439,1,41.758,a8w8_blockscale_1x128x128_256x32x128x256_16x16_32x32_16x16x1_16x16x1_1x16x1x16_8_1x1_intrawave_v1
304,288,7168,2048,2548,0,25.2566,a8w8_blockscale_1x128x128_256x64x64x256_16x16_16x16_16x16x1_16x16x1_1x32x1x8_8_1x2_intrawave_v1
304,288,7168,16384,2131,3,147.0963,a8w8_blockscale_1x128x128_256x64x64x256_16x16_16x16_16x16x1_16x16x1_1x16x1x16_4_1x4_intrawave_v1
304,288,24576,1536,7338,2,50.1396,a8w8_blockscale_1x128x128_256x128x128x128_16x16_16x16_8x32x1_8x32x1_1x8x1x32_4_1x4_intrawave_v3
304,320,128,512,234,1,4.0582,a8w8_blockscale_1x128x128_256x32x32x512_16x16_16x16_32x8x1_32x8x1_1x32x1x8_4_1x1_intrawave_v1
304,320,256,7168,234,2,12.3593,a8w8_blockscale_1x128x128_256x32x32x512_16x16_16x16_32x8x1_32x8x1_1x32x1x8_4_1x1_intrawave_v1
304,320,512,128,130,0,2.9966,a8w8_blockscale_1x128x128_256x32x32x128_16x16_16x16_8x32x1_8x32x1_1x32x1x8_4_1x1_intrawave_v1
304,320,2112,7168,2147,1,28.7546,a8w8_blockscale_1x128x128_256x64x64x256_16x16_16x16_16x16x1_16x16x1_1x32x1x8_8_1x4_intrawave_v1
304,320,4096,7168,6774,0,60.2291,a8w8_blockscale_1x128x128_256x128x64x128_16x16_32x32_8x32x1_8x32x1_1x32x1x8_8_1x2_intrawave_v3
304,320,7168,2048,2518,1,25.4798,a8w8_blockscale_1x128x128_256x64x64x256_16x16_16x16_16x16x1_16x16x1_1x16x1x16_4_2x2_intrawave_v1
304,320,7168,16384,3289,2,160.0204,a8w8_blockscale_1x128x128_256x64x128x128_16x8_16x16_8x32x1_8x32x1_1x32x1x8_4_1x2_intrawave_v3
304,320,24576,1536,7473,0,52.8741,a8w8_blockscale_1x128x128_256x128x128x128_16x16_16x16_8x32x1_8x32x1_1x32x1x8_4_4x1_intrawave_v3
304,352,128,512,234,3,3.433,a8w8_blockscale_1x128x128_256x32x32x512_16x16_16x16_32x8x1_32x8x1_1x32x1x8_4_1x1_intrawave_v1
304,352,256,7168,234,0,12.5889,a8w8_blockscale_1x128x128_256x32x32x512_16x16_16x16_32x8x1_32x8x1_1x32x1x8_4_1x1_intrawave_v1
304,352,512,128,130,2,3.5498,a8w8_blockscale_1x128x128_256x32x32x128_16x16_16x16_8x32x1_8x32x1_1x32x1x8_4_1x1_intrawave_v1
304,352,2112,7168,3204,1,31.5591,a8w8_blockscale_1x128x128_256x64x64x256_16x16_32x32_16x16x1_16x16x1_1x16x1x16_4_1x1_intrawave_v1
304,352,4096,7168,6752,3,62.2804,a8w8_blockscale_1x128x128_256x128x64x128_16x16_32x32_8x32x1_8x32x1_1x16x1x16_4_1x2_intrawave_v3
304,352,7168,2048,3204,3,32.0634,a8w8_blockscale_1x128x128_256x64x64x256_16x16_32x32_16x16x1_16x16x1_1x16x1x16_4_1x1_intrawave_v1
304,352,7168,16384,3204,2,190.1992,a8w8_blockscale_1x128x128_256x64x64x256_16x16_32x32_16x16x1_16x16x1_1x16x1x16_4_1x1_intrawave_v1
304,352,24576,1536,7390,2,52.3518,a8w8_blockscale_1x128x128_256x128x128x128_16x16_16x16_8x32x1_8x32x1_1x16x1x16_4_2x2_intrawave_v3
304,384,128,512,234,1,3.9746,a8w8_blockscale_1x128x128_256x32x32x512_16x16_16x16_32x8x1_32x8x1_1x32x1x8_4_1x1_intrawave_v1
304,384,256,7168,234,2,12.6165,a8w8_blockscale_1x128x128_256x32x32x512_16x16_16x16_32x8x1_32x8x1_1x32x1x8_4_1x1_intrawave_v1
304,384,512,128,124,0,2.9846,a8w8_blockscale_1x128x128_256x32x32x128_8x8_16x16_8x32x1_8x32x1_1x32x1x8_4_1x1_intrawave_v1
304,384,2112,7168,2147,3,30.4419,a8w8_blockscale_1x128x128_256x64x64x256_16x16_16x16_16x16x1_16x16x1_1x32x1x8_8_1x4_intrawave_v1
304,384,4096,7168,6771,2,64.2242,a8w8_blockscale_1x128x128_256x128x64x128_16x16_32x32_8x32x1_8x32x1_1x32x1x8_4_1x1_intrawave_v1
304,384,7168,2048,2131,3,32.2432,a8w8_blockscale_1x128x128_256x64x64x256_16x16_16x16_16x16x1_16x16x1_1x16x1x16_4_1x4_intrawave_v1
304,384,7168,16384,8253,3,216.7302,a8w8_blockscale_1x128x128_256x128x128x128_16x8_32x32_8x32x1_8x32x1_1x16x1x16_4_1x2_intrawave_v1
304,384,24576,1536,7387,0,54.1466,a8w8_blockscale_1x128x128_256x128x128x128_16x16_16x16_8x32x1_8x32x1_1x16x1x16_8_1x4_intrawave_v1
304,416,128,512,234,0,3.9837,a8w8_blockscale_1x128x128_256x32x32x512_16x16_16x16_32x8x1_32x8x1_1x32x1x8_4_1x1_intrawave_v1
304,416,256,7168,234,3,12.5588,a8w8_blockscale_1x128x128_256x32x32x512_16x16_16x16_32x8x1_32x8x1_1x32x1x8_4_1x1_intrawave_v1
304,416,512,128,130,1,3.0294,a8w8_blockscale_1x128x128_256x32x32x128_16x16_16x16_8x32x1_8x32x1_1x32x1x8_4_1x1_intrawave_v1
304,416,2112,7168,3204,3,33.5253,a8w8_blockscale_1x128x128_256x64x64x256_16x16_32x32_16x16x1_16x16x1_1x16x1x16_4_1x1_intrawave_v1
304,416,4096,7168,2547,0,57.4705,a8w8_blockscale_1x128x128_256x64x64x256_16x16_16x16_16x16x1_16x16x1_1x32x1x8_4_1x1_intrawave_v1
304,416,7168,2048,7396,3,31.5953,a8w8_blockscale_1x128x128_256x128x128x128_16x16_16x16_8x32x1_8x32x1_1x16x1x16_8_4x4_intrawave_v3
304,416,7168,16384,3204,3,201.3207,a8w8_blockscale_1x128x128_256x64x64x256_16x16_32x32_16x16x1_16x16x1_1x16x1x16_4_1x1_intrawave_v1
304,416,24576,1536,7392,3,70.5436,a8w8_blockscale_1x128x128_256x128x128x128_16x16_16x16_8x32x1_8x32x1_1x16x1x16_8_2x4_intrawave_v3
304,448,128,512,234,2,3.4505,a8w8_blockscale_1x128x128_256x32x32x512_16x16_16x16_32x8x1_32x8x1_1x32x1x8_4_1x1_intrawave_v1
304,448,256,7168,234,2,12.61,a8w8_blockscale_1x128x128_256x32x32x512_16x16_16x16_32x8x1_32x8x1_1x32x1x8_4_1x1_intrawave_v1
304,448,512,128,130,3,3.6241,a8w8_blockscale_1x128x128_256x32x32x128_16x16_16x16_8x32x1_8x32x1_1x32x1x8_4_1x1_intrawave_v1
304,448,2112,7168,2131,3,33.0166,a8w8_blockscale_1x128x128_256x64x64x256_16x16_16x16_16x16x1_16x16x1_1x16x1x16_4_1x4_intrawave_v1
304,448,4096,7168,4668,0,66.3134,a8w8_blockscale_1x128x128_256x64x128x256_16x16_32x32_16x16x1_16x16x1_1x16x1x16_4_1x1_intrawave_v1
304,448,7168,2048,3214,3,31.9581,a8w8_blockscale_1x128x128_256x64x64x256_16x16_32x32_16x16x1_16x16x1_1x32x1x8_8_1x1_intrawave_v1
304,448,7168,16384,2146,3,193.6611,a8w8_blockscale_1x128x128_256x64x64x256_16x16_16x16_16x16x1_16x16x1_1x32x1x8_4_1x2_intrawave_v1
304,448,24576,1536,7390,3,71.3861,a8w8_blockscale_1x128x128_256x128x128x128_16x16_16x16_8x32x1_8x32x1_1x16x1x16_4_2x2_intrawave_v3
304,480,128,512,234,0,3.9445,a8w8_blockscale_1x128x128_256x32x32x512_16x16_16x16_32x8x1_32x8x1_1x32x1x8_4_1x1_intrawave_v1
304,480,256,7168,234,2,12.9424,a8w8_blockscale_1x128x128_256x32x32x512_16x16_16x16_32x8x1_32x8x1_1x32x1x8_4_1x1_intrawave_v1
304,480,512,128,146,3,3.0366,a8w8_blockscale_1x128x128_256x32x32x128_16x8_16x16_8x32x1_16x16x1_1x32x1x8_4_1x1_intrawave_v1
304,480,2112,7168,3204,3,37.3432,a8w8_blockscale_1x128x128_256x64x64x256_16x16_32x32_16x16x1_16x16x1_1x16x1x16_4_1x1_intrawave_v1
304,480,4096,7168,4525,0,65.8292,a8w8_blockscale_1x128x128_256x64x128x128_16x16_32x32_8x32x1_8x32x1_1x16x1x16_4_1x1_intrawave_v3
304,480,7168,2048,7340,0,33.7684,a8w8_blockscale_1x128x128_256x128x128x128_16x16_16x16_8x32x1_8x32x1_1x8x1x32_4_2x4_intrawave_v3
304,480,7168,16384,3204,1,217.4721,a8w8_blockscale_1x128x128_256x64x64x256_16x16_32x32_16x16x1_16x16x1_1x16x1x16_4_1x1_intrawave_v1
304,480,24576,1536,7390,1,71.9246,a8w8_blockscale_1x128x128_256x128x128x128_16x16_16x16_8x32x1_8x32x1_1x16x1x16_4_2x2_intrawave_v3
304,512,128,512,234,2,4.0049,a8w8_blockscale_1x128x128_256x32x32x512_16x16_16x16_32x8x1_32x8x1_1x32x1x8_4_1x1_intrawave_v1
304,512,256,7168,234,1,12.8218,a8w8_blockscale_1x128x128_256x32x32x512_16x16_16x16_32x8x1_32x8x1_1x32x1x8_4_1x1_intrawave_v1
304,512,512,128,130,0,3.6445,a8w8_blockscale_1x128x128_256x32x32x128_16x16_16x16_8x32x1_8x32x1_1x32x1x8_4_1x1_intrawave_v1
304,512,512,7168,1824,3,15.0546,a8w8_blockscale_1x128x128_256x64x32x512_16x16_16x16_32x8x1_32x8x1_1x32x1x8_4_1x2_intrawave_v1
304,512,576,7168,1824,1,15.3606,a8w8_blockscale_1x128x128_256x64x32x512_16x16_16x16_32x8x1_32x8x1_1x32x1x8_4_1x2_intrawave_v1
304,512,1536,7168,2146,2,30.0118,a8w8_blockscale_1x128x128_256x64x64x256_16x16_16x16_16x16x1_16x16x1_1x32x1x8_4_1x2_intrawave_v1
304,512,1536,8192,2131,1,34.009,a8w8_blockscale_1x128x128_256x64x64x256_16x16_16x16_16x16x1_16x16x1_1x16x1x16_4_1x4_intrawave_v1
304,512,2112,7168,2147,2,34.3112,a8w8_blockscale_1x128x128_256x64x64x256_16x16_16x16_16x16x1_16x16x1_1x32x1x8_8_1x4_intrawave_v1
304,512,3072,1536,2250,2,16.0494,a8w8_blockscale_1x128x128_256x64x64x256_16x16_16x16_8x32x1_8x32x1_1x16x1x16_4_2x2_intrawave_v1
304,512,4096,512,3204,0,8.4608,a8w8_blockscale_1x128x128_256x64x64x256_16x16_32x32_16x16x1_16x16x1_1x16x1x16_4_1x1_intrawave_v1
304,512,4096,7168,3458,2,70.6882,a8w8_blockscale_1x128x128_256x64x128x128_16x16_16x16_8x32x1_8x32x1_1x16x1x16_8_2x4_intrawave_v3
304,512,4608,7168,3414,1,73.62,a8w8_blockscale_1x128x128_256x64x128x128_16x16_16x16_8x32x1_8x32x1_1x8x1x32_4_2x4_intrawave_v3
304,512,7168,256,3112,3,8.7248,a8w8_blockscale_1x128x128_256x64x64x128_16x16_32x32_8x32x1_8x32x1_1x16x1x16_4_1x1_intrawave_v1
304,512,7168,2048,7067,2,34.0288,a8w8_blockscale_1x128x128_256x128x128x128_16x16_16x16_8x32x1_8x32x1_1x16x1x16_4_1x4_intrawave_v3
304,512,7168,2304,7391,1,35.0111,a8w8_blockscale_1x128x128_256x128x128x128_16x16_16x16_8x32x1_8x32x1_1x16x1x16_8_2x4_intrawave_v1
304,512,7168,16384,7111,0,225.645,a8w8_blockscale_1x128x128_256x128x128x128_16x16_16x16_8x32x1_8x32x1_1x32x1x8_4_2x2_intrawave_v3
304,512,8192,1536,7339,1,29.0433,a8w8_blockscale_1x128x128_256x128x128x128_16x16_16x16_8x32x1_8x32x1_1x8x1x32_4_2x4_intrawave_v1
304,512,8192,7168,7067,3,102.0861,a8w8_blockscale_1x128x128_256x128x128x128_16x16_16x16_8x32x1_8x32x1_1x16x1x16_4_1x4_intrawave_v3
304,512,24576,1536,7067,3,71.7168,a8w8_blockscale_1x128x128_256x128x128x128_16x16_16x16_8x32x1_8x32x1_1x16x1x16_4_1x4_intrawave_v3
304,544,128,512,176,2,3.4489,a8w8_blockscale_1x128x128_256x32x32x256_16x8_16x16_16x16x1_8x32x1_1x32x1x8_4_1x1_intrawave_v1
304,544,256,7168,234,2,12.6939,a8w8_blockscale_1x128x128_256x32x32x512_16x16_16x16_32x8x1_32x8x1_1x32x1x8_4_1x1_intrawave_v1
304,544,512,128,130,1,3.0569,a8w8_blockscale_1x128x128_256x32x32x128_16x16_16x16_8x32x1_8x32x1_1x32x1x8_4_1x1_intrawave_v1
304,544,2112,7168,3214,0,41.2422,a8w8_blockscale_1x128x128_256x64x64x256_16x16_32x32_16x16x1_16x16x1_1x32x1x8_8_1x1_intrawave_v1
304,544,4096,7168,2549,3,65.618,a8w8_blockscale_1x128x128_256x64x64x256_16x16_16x16_16x16x1_16x16x1_1x32x1x8_4_2x1_intrawave_v1
304,544,7168,2048,7392,2,37.5682,a8w8_blockscale_1x128x128_256x128x128x128_16x16_16x16_8x32x1_8x32x1_1x16x1x16_8_2x4_intrawave_v3
304,544,7168,16384,3293,0,239.7126,a8w8_blockscale_1x128x128_256x64x128x128_16x16_16x16_8x32x1_8x32x1_1x32x1x8_4_1x2_intrawave_v3
304,544,24576,1536,4527,0,85.3408,a8w8_blockscale_1x128x128_256x64x128x128_16x16_32x32_8x32x1_8x32x1_1x16x1x16_8_1x2_intrawave_v3
304,1024,256,7168,1824,0,15.5329,a8w8_blockscale_1x128x128_256x64x32x512_16x16_16x16_32x8x1_32x8x1_1x32x1x8_4_1x2_intrawave_v1
304,1024,512,7168,468,3,22.1598,a8w8_blockscale_1x128x128_256x32x64x512_16x16_16x16_32x8x1_32x8x1_1x16x1x16_4_1x2_intrawave_v1
304,1024,576,7168,1813,1,25.0279,a8w8_blockscale_1x128x128_256x64x32x512_16x16_16x16_32x8x1_8x32x1_1x32x1x8_4_1x2_intrawave_v1
304,1024,1536,7168,4521,2,62.0946,a8w8_blockscale_1x128x128_256x64x128x128_16x8_32x32_8x32x1_8x32x1_1x16x1x16_4_1x1_intrawave_v3
304,1024,1536,8192,4503,3,70.2575,a8w8_blockscale_1x128x128_256x64x128x128_16x8_32x32_8x32x1_8x32x1_1x8x1x32_4_1x2_intrawave_v3
304,1024,3072,1536,7391,1,25.9671,a8w8_blockscale_1x128x128_256x128x128x128_16x16_16x16_8x32x1_8x32x1_1x16x1x16_8_2x4_intrawave_v1
304,1024,4096,512,7393,3,14.4193,a8w8_blockscale_1x128x128_256x128x128x128_16x16_16x16_8x32x1_8x32x1_1x16x1x16_4_4x2_intrawave_v1
304,1024,4608,7168,7111,1,101.8343,a8w8_blockscale_1x128x128_256x128x128x128_16x16_16x16_8x32x1_8x32x1_1x32x1x8_4_2x2_intrawave_v3
304,1024,7168,256,5880,2,14.3497,a8w8_blockscale_1x128x128_256x128x64x128_16x16_16x16_8x32x1_8x32x1_1x16x1x16_4_2x4_intrawave_v1
304,1024,7168,2048,7067,3,56.4125,a8w8_blockscale_1x128x128_256x128x128x128_16x16_16x16_8x32x1_8x32x1_1x16x1x16_4_1x4_intrawave_v3
304,1024,7168,2304,7460,1,57.8569,a8w8_blockscale_1x128x128_256x128x128x128_16x16_16x16_8x32x1_8x32x1_1x32x1x8_4_1x1_intrawave_v1
304,1024,8192,1536,7389,0,48.6394,a8w8_blockscale_1x128x128_256x128x128x128_16x16_16x16_8x32x1_8x32x1_1x16x1x16_4_2x2_intrawave_v1
304,1024,8192,7168,7107,2,163.3899,a8w8_blockscale_1x128x128_256x128x128x128_16x16_16x16_8x32x1_8x32x1_1x32x1x8_4_1x2_intrawave_v3
304,1049,512,7168,389,2,26.2001,a8w8_blockscale_1x128x128_256x32x64x512_16x16_16x16_16x16x1_16x16x1_1x16x1x16_4_1x2_intrawave_v1
304,1049,1536,7168,6772,3,61.5726,a8w8_blockscale_1x128x128_256x128x64x128_16x16_32x32_8x32x1_8x32x1_1x32x1x8_4_1x1_intrawave_v3
304,1049,1536,8192,3292,3,70.4151,a8w8_blockscale_1x128x128_256x64x128x128_16x16_16x16_8x32x1_8x32x1_1x32x1x8_4_1x2_intrawave_v1
304,1049,3072,1536,7473,2,26.3776,a8w8_blockscale_1x128x128_256x128x128x128_16x16_16x16_8x32x1_8x32x1_1x32x1x8_4_4x1_intrawave_v3
304,1049,4096,512,7339,0,15.0155,a8w8_blockscale_1x128x128_256x128x128x128_16x16_16x16_8x32x1_8x32x1_1x8x1x32_4_2x4_intrawave_v1
304,1049,4608,7168,9404,1,153.0583,a8w8_blockscale_1x128x128_256x128x256x128_16x16_16x16_8x32x1_8x32x1_1x8x1x32_4_4x4_intrawave_v1
304,1049,7168,256,7466,2,15.846,a8w8_blockscale_1x128x128_256x128x128x128_16x16_16x16_8x32x1_8x32x1_1x32x1x8_4_2x1_intrawave_v1
304,1049,7168,2048,7387,3,62.2488,a8w8_blockscale_1x128x128_256x128x128x128_16x16_16x16_8x32x1_8x32x1_1x16x1x16_8_1x4_intrawave_v1
304,1049,7168,2304,7388,0,61.1603,a8w8_blockscale_1x128x128_256x128x128x128_16x16_16x16_8x32x1_8x32x1_1x16x1x16_8_1x4_intrawave_v3
304,1049,8192,1536,7390,0,50.7315,a8w8_blockscale_1x128x128_256x128x128x128_16x16_16x16_8x32x1_8x32x1_1x16x1x16_4_2x2_intrawave_v3
304,1049,8192,7168,7460,3,187.82,a8w8_blockscale_1x128x128_256x128x128x128_16x16_16x16_8x32x1_8x32x1_1x32x1x8_4_1x1_intrawave_v1
304,2048,256,7168,1824,3,22.5311,a8w8_blockscale_1x128x128_256x64x32x512_16x16_16x16_32x8x1_32x8x1_1x32x1x8_4_1x2_intrawave_v1
304,2048,512,7168,2147,2,33.6611,a8w8_blockscale_1x128x128_256x64x64x256_16x16_16x16_16x16x1_16x16x1_1x32x1x8_8_1x4_intrawave_v1
304,2048,576,7168,2131,2,36.4919,a8w8_blockscale_1x128x128_256x64x64x256_16x16_16x16_16x16x1_16x16x1_1x16x1x16_4_1x4_intrawave_v1
304,2048,1536,7168,7067,1,93.4394,a8w8_blockscale_1x128x128_256x128x128x128_16x16_16x16_8x32x1_8x32x1_1x16x1x16_4_1x4_intrawave_v3
304,2048,1536,8192,8253,3,107.1012,a8w8_blockscale_1x128x128_256x128x128x128_16x8_32x32_8x32x1_8x32x1_1x16x1x16_4_1x2_intrawave_v1
304,2048,3072,1536,7472,1,42.4163,a8w8_blockscale_1x128x128_256x128x128x128_16x16_16x16_8x32x1_8x32x1_1x32x1x8_4_4x1_intrawave_v1
304,2048,4096,512,7385,2,24.8901,a8w8_blockscale_1x128x128_256x128x128x128_16x16_16x16_8x32x1_8x32x1_1x16x1x16_4_1x2_intrawave_v1
304,2048,4608,7168,7067,3,167.2582,a8w8_blockscale_1x128x128_256x128x128x128_16x16_16x16_8x32x1_8x32x1_1x16x1x16_4_1x4_intrawave_v3
304,2048,7168,256,7106,0,27.431,a8w8_blockscale_1x128x128_256x128x128x128_16x16_16x16_8x32x1_8x32x1_1x32x1x8_4_1x2_intrawave_v1
304,2048,7168,2048,7067,2,90.6299,a8w8_blockscale_1x128x128_256x128x128x128_16x16_16x16_8x32x1_8x32x1_1x16x1x16_4_1x4_intrawave_v3
304,2048,7168,2304,7391,2,92.7754,a8w8_blockscale_1x128x128_256x128x128x128_16x16_16x16_8x32x1_8x32x1_1x16x1x16_8_2x4_intrawave_v1
304,2048,8192,1536,7385,2,85.645,a8w8_blockscale_1x128x128_256x128x128x128_16x16_16x16_8x32x1_8x32x1_1x16x1x16_4_1x2_intrawave_v1
304,2048,8192,7168,7067,1,321.4595,a8w8_blockscale_1x128x128_256x128x128x128_16x16_16x16_8x32x1_8x32x1_1x16x1x16_4_1x4_intrawave_v3
304,2093,512,7168,2131,3,38.2784,a8w8_blockscale_1x128x128_256x64x64x256_16x16_16x16_16x16x1_16x16x1_1x16x1x16_4_1x4_intrawave_v1
304,2093,1536,7168,2550,0,97.4956,a8w8_blockscale_1x128x128_256x64x64x256_16x16_16x16_16x16x1_16x16x1_1x32x1x8_8_2x2_intrawave_v1
304,2093,1536,8192,2097,1,107.5076,a8w8_blockscale_1x128x128_256x64x64x256_16x16_16x16_16x16x1_8x32x1_1x16x1x16_4_1x4_intrawave_v1
304,2093,3072,1536,3412,1,42.7085,a8w8_blockscale_1x128x128_256x64x128x128_16x16_16x16_8x32x1_8x32x1_1x8x1x32_4_1x4_intrawave_v3
304,2093,4096,512,7390,0,25.3353,a8w8_blockscale_1x128x128_256x128x128x128_16x16_16x16_8x32x1_8x32x1_1x16x1x16_4_2x2_intrawave_v3
304,2093,4608,7168,4525,3,220.6175,a8w8_blockscale_1x128x128_256x64x128x128_16x16_32x32_8x32x1_8x32x1_1x16x1x16_4_1x1_intrawave_v3
304,2093,7168,256,2289,1,28.6728,a8w8_blockscale_1x128x128_256x64x64x128_16x16_16x16_8x32x1_8x32x1_1x32x1x8_8_1x2_intrawave_v1
304,2093,7168,2048,7337,3,110.0405,a8w8_blockscale_1x128x128_256x128x128x128_16x16_16x16_8x32x1_8x32x1_1x8x1x32_4_1x4_intrawave_v1
304,2093,7168,2304,7392,1,109.4621,a8w8_blockscale_1x128x128_256x128x128x128_16x16_16x16_8x32x1_8x32x1_1x16x1x16_8_2x4_intrawave_v3
304,2093,8192,1536,7463,3,89.0898,a8w8_blockscale_1x128x128_256x128x128x128_16x16_16x16_8x32x1_8x32x1_1x32x1x8_8_1x2_intrawave_v3
304,2093,8192,7168,9475,1,361.5486,a8w8_blockscale_1x128x128_256x128x256x128_16x16_16x16_8x32x1_8x32x1_1x32x1x8_8_2x2_intrawave_v1
304,4096,256,7168,2147,1,35.1499,a8w8_blockscale_1x128x128_256x64x64x256_16x16_16x16_16x16x1_16x16x1_1x32x1x8_8_1x4_intrawave_v1
304,4096,512,7168,4521,2,66.3686,a8w8_blockscale_1x128x128_256x64x128x128_16x8_32x32_8x32x1_8x32x1_1x16x1x16_4_1x1_intrawave_v3
304,4096,576,7168,2517,1,63.4815,a8w8_blockscale_1x128x128_256x64x64x256_16x16_16x16_16x16x1_16x16x1_1x16x1x16_4_1x2_intrawave_v1
304,4096,1536,7168,7067,3,141.1389,a8w8_blockscale_1x128x128_256x128x128x128_16x16_16x16_8x32x1_8x32x1_1x16x1x16_4_1x4_intrawave_v3
304,4096,1536,8192,7107,1,158.738,a8w8_blockscale_1x128x128_256x128x128x128_16x16_16x16_8x32x1_8x32x1_1x32x1x8_4_1x2_intrawave_v3
304,4096,3072,1536,7385,3,68.9162,a8w8_blockscale_1x128x128_256x128x128x128_16x16_16x16_8x32x1_8x32x1_1x16x1x16_4_1x2_intrawave_v1
304,4096,4096,512,7466,2,44.2975,a8w8_blockscale_1x128x128_256x128x128x128_16x16_16x16_8x32x1_8x32x1_1x32x1x8_4_2x1_intrawave_v1
304,4096,4608,7168,7107,2,333.5838,a8w8_blockscale_1x128x128_256x128x128x128_16x16_16x16_8x32x1_8x32x1_1x32x1x8_4_1x2_intrawave_v3
304,4096,7168,256,7339,3,45.7023,a8w8_blockscale_1x128x128_256x128x128x128_16x16_16x16_8x32x1_8x32x1_1x8x1x32_4_2x4_intrawave_v1
304,4096,7168,2048,7067,2,163.6502,a8w8_blockscale_1x128x128_256x128x128x128_16x16_16x16_8x32x1_8x32x1_1x16x1x16_4_1x4_intrawave_v3
304,4096,7168,2304,7462,0,173.9026,a8w8_blockscale_1x128x128_256x128x128x128_16x16_16x16_8x32x1_8x32x1_1x32x1x8_8_1x2_intrawave_v1
304,4096,8192,1536,7067,3,149.9468,a8w8_blockscale_1x128x128_256x128x128x128_16x16_16x16_8x32x1_8x32x1_1x16x1x16_4_1x4_intrawave_v3
304,4096,8192,7168,7067,2,564.1969,a8w8_blockscale_1x128x128_256x128x128x128_16x16_16x16_8x32x1_8x32x1_1x16x1x16_4_1x4_intrawave_v3
304,8192,256,7168,3436,2,68.9175,a8w8_blockscale_1x128x128_256x64x128x128_8x16_16x16_8x32x1_8x32x1_1x16x1x16_4_1x2_intrawave_v3
304,8192,512,7168,7111,1,101.6332,a8w8_blockscale_1x128x128_256x128x128x128_16x16_16x16_8x32x1_8x32x1_1x32x1x8_4_2x2_intrawave_v3
304,8192,576,7168,6770,0,115.617,a8w8_blockscale_1x128x128_256x128x64x128_16x8_32x32_8x32x1_8x32x1_1x32x1x8_8_1x2_intrawave_v3
304,8192,1536,7168,7067,3,239.065,a8w8_blockscale_1x128x128_256x128x128x128_16x16_16x16_8x32x1_8x32x1_1x16x1x16_4_1x4_intrawave_v3
304,8192,1536,8192,7107,1,270.5689,a8w8_blockscale_1x128x128_256x128x128x128_16x16_16x16_8x32x1_8x32x1_1x32x1x8_4_1x2_intrawave_v3
304,8192,3072,1536,7462,1,120.7788,a8w8_blockscale_1x128x128_256x128x128x128_16x16_16x16_8x32x1_8x32x1_1x32x1x8_8_1x2_intrawave_v1
304,8192,4096,512,7389,0,72.0902,a8w8_blockscale_1x128x128_256x128x128x128_16x16_16x16_8x32x1_8x32x1_1x16x1x16_4_2x2_intrawave_v1
304,8192,4608,7168,7111,0,656.8402,a8w8_blockscale_1x128x128_256x128x128x128_16x16_16x16_8x32x1_8x32x1_1x32x1x8_4_2x2_intrawave_v3
304,8192,7168,256,7068,3,83.0087,a8w8_blockscale_1x128x128_256x128x128x128_16x16_16x16_8x32x1_8x32x1_1x16x1x16_4_2x4_intrawave_v1
304,8192,7168,2048,7107,3,310.018,a8w8_blockscale_1x128x128_256x128x128x128_16x16_16x16_8x32x1_8x32x1_1x32x1x8_4_1x2_intrawave_v3
304,8192,7168,2304,7389,2,323.4895,a8w8_blockscale_1x128x128_256x128x128x128_16x16_16x16_8x32x1_8x32x1_1x16x1x16_4_2x2_intrawave_v1
304,8192,8192,1536,7387,1,278.9705,a8w8_blockscale_1x128x128_256x128x128x128_16x16_16x16_8x32x1_8x32x1_1x16x1x16_8_1x4_intrawave_v1
304,8192,8192,7168,7067,2,1134.3003,a8w8_blockscale_1x128x128_256x128x128x128_16x16_16x16_8x32x1_8x32x1_1x16x1x16_4_1x4_intrawave_v3
304,16384,256,7168,7067,3,106.2092,a8w8_blockscale_1x128x128_256x128x128x128_16x16_16x16_8x32x1_8x32x1_1x16x1x16_4_1x4_intrawave_v3
304,16384,512,7168,7067,1,164.9872,a8w8_blockscale_1x128x128_256x128x128x128_16x16_16x16_8x32x1_8x32x1_1x16x1x16_4_1x4_intrawave_v3
304,16384,576,7168,6770,2,227.0921,a8w8_blockscale_1x128x128_256x128x64x128_16x8_32x32_8x32x1_8x32x1_1x32x1x8_8_1x2_intrawave_v3
304,16384,1536,7168,7111,2,475.3552,a8w8_blockscale_1x128x128_256x128x128x128_16x16_16x16_8x32x1_8x32x1_1x32x1x8_4_2x2_intrawave_v3
304,16384,1536,8192,7107,1,524.1242,a8w8_blockscale_1x128x128_256x128x128x128_16x16_16x16_8x32x1_8x32x1_1x32x1x8_4_1x2_intrawave_v3
304,16384,3072,1536,7387,1,220.2201,a8w8_blockscale_1x128x128_256x128x128x128_16x16_16x16_8x32x1_8x32x1_1x16x1x16_8_1x4_intrawave_v1
304,16384,4096,512,7462,2,131.9649,a8w8_blockscale_1x128x128_256x128x128x128_16x16_16x16_8x32x1_8x32x1_1x32x1x8_8_1x2_intrawave_v1
304,16384,4608,7168,7107,3,1280.8448,a8w8_blockscale_1x128x128_256x128x128x128_16x16_16x16_8x32x1_8x32x1_1x32x1x8_4_1x2_intrawave_v3
304,16384,7168,256,7068,2,155.4682,a8w8_blockscale_1x128x128_256x128x128x128_16x16_16x16_8x32x1_8x32x1_1x16x1x16_4_2x4_intrawave_v1
304,16384,7168,2048,7107,3,600.4152,a8w8_blockscale_1x128x128_256x128x128x128_16x16_16x16_8x32x1_8x32x1_1x32x1x8_4_1x2_intrawave_v3
304,16384,7168,2304,7460,2,631.8924,a8w8_blockscale_1x128x128_256x128x128x128_16x16_16x16_8x32x1_8x32x1_1x32x1x8_4_1x1_intrawave_v1
304,16384,8192,1536,7462,1,545.5643,a8w8_blockscale_1x128x128_256x128x128x128_16x16_16x16_8x32x1_8x32x1_1x32x1x8_8_1x2_intrawave_v1
304,16384,8192,7168,7107,2,2299.7348,a8w8_blockscale_1x128x128_256x128x128x128_16x16_16x16_8x32x1_8x32x1_1x32x1x8_4_1x2_intrawave_v3
304,29130,512,7168,7466,2,311.9333,a8w8_blockscale_1x128x128_256x128x128x128_16x16_16x16_8x32x1_8x32x1_1x32x1x8_4_2x1_intrawave_v1
304,29130,1536,7168,7460,1,900.4964,a8w8_blockscale_1x128x128_256x128x128x128_16x16_16x16_8x32x1_8x32x1_1x32x1x8_4_1x1_intrawave_v1
304,29130,1536,8192,7460,1,1040.5534,a8w8_blockscale_1x128x128_256x128x128x128_16x16_16x16_8x32x1_8x32x1_1x32x1x8_4_1x1_intrawave_v1
304,29130,3072,1536,7461,2,382.4828,a8w8_blockscale_1x128x128_256x128x128x128_16x16_16x16_8x32x1_8x32x1_1x32x1x8_4_1x1_intrawave_v3
304,29130,4096,512,7385,3,241.7796,a8w8_blockscale_1x128x128_256x128x128x128_16x16_16x16_8x32x1_8x32x1_1x16x1x16_4_1x2_intrawave_v1
304,29130,4608,7168,7390,1,2548.1111,a8w8_blockscale_1x128x128_256x128x128x128_16x16_16x16_8x32x1_8x32x1_1x16x1x16_4_2x2_intrawave_v3
304,29130,7168,256,7068,2,281.5809,a8w8_blockscale_1x128x128_256x128x128x128_16x16_16x16_8x32x1_8x32x1_1x16x1x16_4_2x4_intrawave_v1
304,29130,7168,2048,7460,3,1121.3689,a8w8_blockscale_1x128x128_256x128x128x128_16x16_16x16_8x32x1_8x32x1_1x32x1x8_4_1x1_intrawave_v1
304,29130,7168,2304,7461,0,1153.7912,a8w8_blockscale_1x128x128_256x128x128x128_16x16_16x16_8x32x1_8x32x1_1x32x1x8_4_1x1_intrawave_v3
304,29130,8192,1536,7461,3,938.4763,a8w8_blockscale_1x128x128_256x128x128x128_16x16_16x16_8x32x1_8x32x1_1x32x1x8_4_1x1_intrawave_v3
304,29130,8192,7168,9434,3,4393.1153,a8w8_blockscale_1x128x128_256x128x256x128_16x16_16x16_8x32x1_8x32x1_1x16x1x16_8_4x4_intrawave_v1
304,32768,256,7168,7067,1,191.8252,a8w8_blockscale_1x128x128_256x128x128x128_16x16_16x16_8x32x1_8x32x1_1x16x1x16_4_1x4_intrawave_v3
304,32768,512,7168,7107,2,351.1146,a8w8_blockscale_1x128x128_256x128x128x128_16x16_16x16_8x32x1_8x32x1_1x32x1x8_4_1x2_intrawave_v3
304,32768,576,7168,2517,2,444.895,a8w8_blockscale_1x128x128_256x64x64x256_16x16_16x16_16x16x1_16x16x1_1x16x1x16_4_1x2_intrawave_v1
304,32768,1536,7168,7067,1,918.912,a8w8_blockscale_1x128x128_256x128x128x128_16x16_16x16_8x32x1_8x32x1_1x16x1x16_4_1x4_intrawave_v3
304,32768,1536,8192,7107,3,1052.8269,a8w8_blockscale_1x128x128_256x128x128x128_16x16_16x16_8x32x1_8x32x1_1x32x1x8_4_1x2_intrawave_v3
304,32768,3072,1536,7391,1,419.5693,a8w8_blockscale_1x128x128_256x128x128x128_16x16_16x16_8x32x1_8x32x1_1x16x1x16_8_2x4_intrawave_v1
304,32768,4096,512,7462,3,259.3495,a8w8_blockscale_1x128x128_256x128x128x128_16x16_16x16_8x32x1_8x32x1_1x32x1x8_8_1x2_intrawave_v1
304,32768,4608,7168,7107,1,2562.223,a8w8_blockscale_1x128x128_256x128x128x128_16x16_16x16_8x32x1_8x32x1_1x32x1x8_4_1x2_intrawave_v3
304,32768,7168,256,7068,3,297.1048,a8w8_blockscale_1x128x128_256x128x128x128_16x16_16x16_8x32x1_8x32x1_1x16x1x16_4_2x4_intrawave_v1
304,32768,7168,2048,7067,3,1149.6266,a8w8_blockscale_1x128x128_256x128x128x128_16x16_16x16_8x32x1_8x32x1_1x16x1x16_4_1x4_intrawave_v3
304,32768,7168,2304,7466,0,1267.3721,a8w8_blockscale_1x128x128_256x128x128x128_16x16_16x16_8x32x1_8x32x1_1x32x1x8_4_2x1_intrawave_v1
304,32768,8192,1536,7462,2,1053.1809,a8w8_blockscale_1x128x128_256x128x128x128_16x16_16x16_8x32x1_8x32x1_1x32x1x8_8_1x2_intrawave_v1
304,32768,8192,7168,7107,0,4625.302,a8w8_blockscale_1x128x128_256x128x128x128_16x16_16x16_8x32x1_8x32x1_1x32x1x8_4_1x2_intrawave_v3
304,36864,256,7168,7107,2,199.0438,a8w8_blockscale_1x128x128_256x128x128x128_16x16_16x16_8x32x1_8x32x1_1x32x1x8_4_1x2_intrawave_v3
304,36864,512,7168,7107,3,370.0322,a8w8_blockscale_1x128x128_256x128x128x128_16x16_16x16_8x32x1_8x32x1_1x32x1x8_4_1x2_intrawave_v3
304,36864,576,7168,7460,2,468.4439,a8w8_blockscale_1x128x128_256x128x128x128_16x16_16x16_8x32x1_8x32x1_1x32x1x8_4_1x1_intrawave_v1
304,36864,1536,7168,7067,1,1004.7859,a8w8_blockscale_1x128x128_256x128x128x128_16x16_16x16_8x32x1_8x32x1_1x16x1x16_4_1x4_intrawave_v3
304,36864,3072,1536,7460,3,469.7461,a8w8_blockscale_1x128x128_256x128x128x128_16x16_16x16_8x32x1_8x32x1_1x32x1x8_4_1x1_intrawave_v1
304,36864,4096,512,7462,3,280.9923,a8w8_blockscale_1x128x128_256x128x128x128_16x16_16x16_8x32x1_8x32x1_1x32x1x8_8_1x2_intrawave_v1
304,36864,4608,7168,7067,3,2919.5716,a8w8_blockscale_1x128x128_256x128x128x128_16x16_16x16_8x32x1_8x32x1_1x16x1x16_4_1x4_intrawave_v3
304,36864,7168,256,7333,1,338.33,a8w8_blockscale_1x128x128_256x128x128x128_16x8_16x16_8x32x1_8x32x1_1x8x1x32_4_2x4_intrawave_v1
304,36864,7168,2048,7107,0,1309.2406,a8w8_blockscale_1x128x128_256x128x128x128_16x16_16x16_8x32x1_8x32x1_1x32x1x8_4_1x2_intrawave_v3
304,36864,7168,2304,7460,3,1425.0429,a8w8_blockscale_1x128x128_256x128x128x128_16x16_16x16_8x32x1_8x32x1_1x32x1x8_4_1x1_intrawave_v1
304,65536,256,7168,7107,3,378.8324,a8w8_blockscale_1x128x128_256x128x128x128_16x16_16x16_8x32x1_8x32x1_1x32x1x8_4_1x2_intrawave_v3
304,65536,512,7168,7067,3,634.684,a8w8_blockscale_1x128x128_256x128x128x128_16x16_16x16_8x32x1_8x32x1_1x16x1x16_4_1x4_intrawave_v3
304,65536,576,7168,7460,3,854.8033,a8w8_blockscale_1x128x128_256x128x128x128_16x16_16x16_8x32x1_8x32x1_1x32x1x8_4_1x1_intrawave_v1
304,65536,1536,7168,7067,3,1787.167,a8w8_blockscale_1x128x128_256x128x128x128_16x16_16x16_8x32x1_8x32x1_1x16x1x16_4_1x4_intrawave_v3
304,65536,3072,1536,7460,1,818.8828,a8w8_blockscale_1x128x128_256x128x128x128_16x16_16x16_8x32x1_8x32x1_1x32x1x8_4_1x1_intrawave_v1
304,65536,4096,512,7462,1,499.1279,a8w8_blockscale_1x128x128_256x128x128x128_16x16_16x16_8x32x1_8x32x1_1x32x1x8_8_1x2_intrawave_v1
304,65536,4608,7168,7107,2,5179.701,a8w8_blockscale_1x128x128_256x128x128x128_16x16_16x16_8x32x1_8x32x1_1x32x1x8_4_1x2_intrawave_v3
304,65536,7168,256,7068,0,585.7215,a8w8_blockscale_1x128x128_256x128x128x128_16x16_16x16_8x32x1_8x32x1_1x16x1x16_4_2x4_intrawave_v1
304,65536,7168,2048,7107,3,2304.8968,a8w8_blockscale_1x128x128_256x128x128x128_16x16_16x16_8x32x1_8x32x1_1x32x1x8_4_1x2_intrawave_v3
304,65536,7168,2304,7460,3,2553.4409,a8w8_blockscale_1x128x128_256x128x128x128_16x16_16x16_8x32x1_8x32x1_1x32x1x8_4_1x1_intrawave_v1
