aiter/configs/a8w8_blockscale_tuned_gemm_bruteforce.csv
cu_num,M,N,K,kernelId,splitK,us,kernelName
304,8,4096,7168,234,2,14.6241,a8w8_blockscale_bruteforce_1x128x128_256x32x32x512_16x16_16x16_32x8x1_32x8x1_1x32x1x8_4_1x1_intrawave_v1
304,8,7168,2048,44,2,8.8548,a8w8_blockscale_bruteforce_1x128x128_256x16x64x512_16x16_16x16_32x8x1_32x8x1_1x16x1x16_4_1x1_intrawave_v1
304,16,4096,7168,44,1,13.8516,a8w8_blockscale_bruteforce_1x128x128_256x16x64x512_16x16_16x16_32x8x1_32x8x1_1x16x1x16_4_1x1_intrawave_v1
304,16,7168,2048,44,3,8.3472,a8w8_blockscale_bruteforce_1x128x128_256x16x64x512_16x16_16x16_32x8x1_32x8x1_1x16x1x16_4_1x1_intrawave_v1
304,24,4096,7168,195,1,15.1503,a8w8_blockscale_bruteforce_1x128x128_256x32x32x512_16x16_16x16_16x16x1_16x16x1_1x32x1x8_4_1x1_intrawave_v1
304,24,7168,2048,44,2,9.259,a8w8_blockscale_bruteforce_1x128x128_256x16x64x512_16x16_16x16_32x8x1_32x8x1_1x16x1x16_4_1x1_intrawave_v1
304,32,128,512,234,0,2.7372,a8w8_blockscale_bruteforce_1x128x128_256x32x32x512_16x16_16x16_32x8x1_32x8x1_1x32x1x8_4_1x1_intrawave_v1
304,32,256,7168,234,0,10.9281,a8w8_blockscale_bruteforce_1x128x128_256x32x32x512_16x16_16x16_32x8x1_32x8x1_1x32x1x8_4_1x1_intrawave_v1
304,32,512,128,130,2,2.7004,a8w8_blockscale_bruteforce_1x128x128_256x32x32x128_16x16_16x16_8x32x1_8x32x1_1x32x1x8_4_1x1_intrawave_v1
304,32,2112,7168,195,3,13.0428,a8w8_blockscale_bruteforce_1x128x128_256x32x32x512_16x16_16x16_16x16x1_16x16x1_1x32x1x8_4_1x1_intrawave_v1
304,32,4096,7168,195,1,13.6856,a8w8_blockscale_bruteforce_1x128x128_256x32x32x512_16x16_16x16_16x16x1_16x16x1_1x32x1x8_4_1x1_intrawave_v1
304,32,7168,2048,44,0,8.6732,a8w8_blockscale_bruteforce_1x128x128_256x16x64x512_16x16_16x16_32x8x1_32x8x1_1x16x1x16_4_1x1_intrawave_v1
304,32,7168,16384,195,3,44.9956,a8w8_blockscale_bruteforce_1x128x128_256x32x32x512_16x16_16x16_16x16x1_16x16x1_1x32x1x8_4_1x1_intrawave_v1
304,32,24576,1536,820,3,17.0682,a8w8_blockscale_bruteforce_1x128x128_256x32x128x256_16x16_16x16_8x32x1_16x16x1_1x16x1x16_8_1x4_intrawave_v1
304,40,4096,7168,21,0,18.1135,a8w8_blockscale_bruteforce_1x128x128_256x16x64x512_16x16_16x16_16x16x1_16x16x1_1x16x1x16_4_1x1_intrawave_v1
304,40,7168,2048,427,3,9.6925,a8w8_blockscale_bruteforce_1x128x128_256x32x64x512_16x16_16x16_16x16x1_32x8x1_1x32x1x8_8_1x2_intrawave_v1
304,48,4096,7168,44,3,17.8567,a8w8_blockscale_bruteforce_1x128x128_256x16x64x512_16x16_16x16_32x8x1_32x8x1_1x16x1x16_4_1x1_intrawave_v1
304,48,7168,2048,415,1,9.8281,a8w8_blockscale_bruteforce_1x128x128_256x32x64x512_16x16_16x16_16x16x1_32x8x1_1x16x1x16_4_1x2_intrawave_v1
304,56,4096,7168,195,2,19.1112,a8w8_blockscale_bruteforce_1x128x128_256x32x32x512_16x16_16x16_16x16x1_16x16x1_1x32x1x8_4_1x1_intrawave_v1
304,56,7168,2048,415,2,9.8997,a8w8_blockscale_bruteforce_1x128x128_256x32x64x512_16x16_16x16_16x16x1_32x8x1_1x16x1x16_4_1x2_intrawave_v1
304,64,128,512,1797,2,3.6373,a8w8_blockscale_bruteforce_1x128x128_256x64x32x256_16x16_16x16_16x16x1_16x16x1_1x32x1x8_4_1x2_intrawave_v1
304,64,256,7168,234,3,11.1254,a8w8_blockscale_bruteforce_1x128x128_256x32x32x512_16x16_16x16_32x8x1_32x8x1_1x32x1x8_4_1x1_intrawave_v1
304,64,512,128,130,0,2.9332,a8w8_blockscale_bruteforce_1x128x128_256x32x32x128_16x16_16x16_8x32x1_8x32x1_1x32x1x8_4_1x1_intrawave_v1
304,64,2112,7168,195,2,13.4415,a8w8_blockscale_bruteforce_1x128x128_256x32x32x512_16x16_16x16_16x16x1_16x16x1_1x32x1x8_4_1x1_intrawave_v1
304,64,4096,7168,343,3,17.7392,a8w8_blockscale_bruteforce_1x128x128_256x32x64x512_16x16_16x16_8x32x1_32x8x1_1x32x1x8_8_1x2_intrawave_v1
304,64,7168,2048,468,1,9.3189,a8w8_blockscale_bruteforce_1x128x128_256x32x64x512_16x16_16x16_32x8x1_32x8x1_1x16x1x16_4_1x2_intrawave_v1
304,64,7168,16384,427,3,55.1276,a8w8_blockscale_bruteforce_1x128x128_256x32x64x512_16x16_16x16_16x16x1_32x8x1_1x32x1x8_8_1x2_intrawave_v1
304,64,24576,1536,3458,2,22.251,a8w8_blockscale_bruteforce_1x128x128_256x64x128x128_16x16_16x16_8x32x1_8x32x1_1x16x1x16_8_2x4_intrawave_v3
304,72,4096,7168,415,2,21.7982,a8w8_blockscale_bruteforce_1x128x128_256x32x64x512_16x16_16x16_16x16x1_32x8x1_1x16x1x16_4_1x2_intrawave_v1
304,72,7168,2048,1997,3,12.4855,a8w8_blockscale_bruteforce_1x128x128_256x64x64x256_16x16_16x16_8x32x1_8x32x1_1x16x1x16_4_1x4_intrawave_v1
304,80,4096,7168,415,1,21.6615,a8w8_blockscale_bruteforce_1x128x128_256x32x64x512_16x16_16x16_16x16x1_32x8x1_1x16x1x16_4_1x2_intrawave_v1
304,80,7168,2048,1997,1,13.1724,a8w8_blockscale_bruteforce_1x128x128_256x64x64x256_16x16_16x16_8x32x1_8x32x1_1x16x1x16_4_1x4_intrawave_v1
304,88,4096,7168,426,3,22.4838,a8w8_blockscale_bruteforce_1x128x128_256x32x64x512_16x16_16x16_16x16x1_32x8x1_1x32x1x8_4_1x1_intrawave_v1
304,88,7168,2048,2131,3,12.8476,a8w8_blockscale_bruteforce_1x128x128_256x64x64x256_16x16_16x16_16x16x1_16x16x1_1x16x1x16_4_1x4_intrawave_v1
304,96,128,512,234,3,3.9128,a8w8_blockscale_bruteforce_1x128x128_256x32x32x512_16x16_16x16_32x8x1_32x8x1_1x32x1x8_4_1x1_intrawave_v1
304,96,256,7168,234,3,11.5389,a8w8_blockscale_bruteforce_1x128x128_256x32x32x512_16x16_16x16_32x8x1_32x8x1_1x32x1x8_4_1x1_intrawave_v1
304,96,512,128,126,0,2.9568,a8w8_blockscale_bruteforce_1x128x128_256x32x32x128_8x16_16x16_8x32x1_8x32x1_1x32x1x8_4_1x1_intrawave_v1
304,96,2112,7168,478,1,15.5385,a8w8_blockscale_bruteforce_1x128x128_256x32x64x512_16x16_16x16_32x8x1_32x8x1_1x32x1x8_8_1x2_intrawave_v1
304,96,4096,7168,409,0,21.7517,a8w8_blockscale_bruteforce_1x128x128_256x32x64x512_16x16_16x16_16x16x1_16x16x1_1x32x1x8_8_1x2_intrawave_v1
304,96,7168,2048,1433,1,13.5036,a8w8_blockscale_bruteforce_1x128x128_256x32x128x256_16x16_32x32_16x16x1_16x16x1_1x8x1x32_4_1x1_intrawave_v1
304,96,7168,16384,3214,3,75.7775,a8w8_blockscale_bruteforce_1x128x128_256x64x64x256_16x16_32x32_16x16x1_16x16x1_1x32x1x8_8_1x1_intrawave_v1
304,96,24576,1536,749,1,26.6896,a8w8_blockscale_bruteforce_1x128x128_256x32x128x128_16x16_16x16_8x32x1_8x32x1_1x16x1x16_8_1x4_intrawave_v3
304,104,4096,7168,409,2,25.9852,a8w8_blockscale_bruteforce_1x128x128_256x32x64x512_16x16_16x16_16x16x1_16x16x1_1x32x1x8_8_1x2_intrawave_v1
304,104,7168,2048,2250,1,14.3188,a8w8_blockscale_bruteforce_1x128x128_256x64x64x256_16x16_16x16_8x32x1_8x32x1_1x16x1x16_4_2x2_intrawave_v1
304,112,4096,7168,389,2,26.0594,a8w8_blockscale_bruteforce_1x128x128_256x32x64x512_16x16_16x16_16x16x1_16x16x1_1x16x1x16_4_1x2_intrawave_v1
304,112,7168,2048,1997,2,13.753,a8w8_blockscale_bruteforce_1x128x128_256x64x64x256_16x16_16x16_8x32x1_8x32x1_1x16x1x16_4_1x4_intrawave_v1
304,120,4096,7168,409,0,26.6543,a8w8_blockscale_bruteforce_1x128x128_256x32x64x512_16x16_16x16_16x16x1_16x16x1_1x32x1x8_8_1x2_intrawave_v1
304,120,7168,2048,2310,0,14.6596,a8w8_blockscale_bruteforce_1x128x128_256x64x64x256_16x16_16x16_8x32x1_8x32x1_1x32x1x8_8_2x2_intrawave_v1
304,128,128,512,195,2,3.4085,a8w8_blockscale_bruteforce_1x128x128_256x32x32x512_16x16_16x16_16x16x1_16x16x1_1x32x1x8_4_1x1_intrawave_v1
304,128,256,7168,195,1,12.3209,a8w8_blockscale_bruteforce_1x128x128_256x32x32x512_16x16_16x16_16x16x1_16x16x1_1x32x1x8_4_1x1_intrawave_v1
304,128,512,128,130,2,3.498,a8w8_blockscale_bruteforce_1x128x128_256x32x32x128_16x16_16x16_8x32x1_8x32x1_1x32x1x8_4_1x1_intrawave_v1
304,128,2112,7168,478,3,15.6266,a8w8_blockscale_bruteforce_1x128x128_256x32x64x512_16x16_16x16_32x8x1_32x8x1_1x32x1x8_8_1x2_intrawave_v1
304,128,4096,7168,415,0,27.3952,a8w8_blockscale_bruteforce_1x128x128_256x32x64x512_16x16_16x16_16x16x1_32x8x1_1x16x1x16_4_1x2_intrawave_v1
304,128,7168,2048,1997,2,13.6786,a8w8_blockscale_bruteforce_1x128x128_256x64x64x256_16x16_16x16_8x32x1_8x32x1_1x16x1x16_4_1x4_intrawave_v1
304,128,7168,16384,2147,1,78.3012,a8w8_blockscale_bruteforce_1x128x128_256x64x64x256_16x16_16x16_16x16x1_16x16x1_1x32x1x8_8_1x4_intrawave_v1
304,128,24576,1536,7393,2,29.9529,a8w8_blockscale_bruteforce_1x128x128_256x128x128x128_16x16_16x16_8x32x1_8x32x1_1x16x1x16_4_4x2_intrawave_v1
304,136,4096,7168,3214,3,30.6226,a8w8_blockscale_bruteforce_1x128x128_256x64x64x256_16x16_32x32_16x16x1_16x16x1_1x32x1x8_8_1x1_intrawave_v1
304,136,7168,2048,1085,1,18.124,a8w8_blockscale_bruteforce_1x128x128_256x32x128x256_16x16_16x16_8x32x1_8x32x1_1x32x1x8_8_2x1_intrawave_v1
304,160,128,512,234,1,3.4048,a8w8_blockscale_bruteforce_1x128x128_256x32x32x512_16x16_16x16_32x8x1_32x8x1_1x32x1x8_4_1x1_intrawave_v1
304,160,256,7168,234,0,12.2853,a8w8_blockscale_bruteforce_1x128x128_256x32x32x512_16x16_16x16_32x8x1_32x8x1_1x32x1x8_4_1x1_intrawave_v1
304,160,512,128,130,0,2.9673,a8w8_blockscale_bruteforce_1x128x128_256x32x32x128_16x16_16x16_8x32x1_8x32x1_1x32x1x8_4_1x1_intrawave_v1
304,160,2112,7168,477,1,18.8665,a8w8_blockscale_bruteforce_1x128x128_256x32x64x512_16x16_16x16_32x8x1_32x8x1_1x32x1x8_4_1x1_intrawave_v1
304,160,4096,7168,3214,1,33.9294,a8w8_blockscale_bruteforce_1x128x128_256x64x64x256_16x16_32x32_16x16x1_16x16x1_1x32x1x8_8_1x1_intrawave_v1
304,160,7168,2048,910,2,17.4304,a8w8_blockscale_bruteforce_1x128x128_256x32x128x256_16x16_16x16_16x16x1_16x16x1_1x8x1x32_4_1x4_intrawave_v1
304,160,7168,16384,922,1,100.4863,a8w8_blockscale_bruteforce_1x128x128_256x32x128x256_16x16_16x16_16x16x1_16x16x1_1x16x1x16_8_1x4_intrawave_v1
304,160,24576,1536,3293,3,35.7884,a8w8_blockscale_bruteforce_1x128x128_256x64x128x128_16x16_16x16_8x32x1_8x32x1_1x32x1x8_4_1x2_intrawave_v3
304,192,128,512,234,1,3.9968,a8w8_blockscale_bruteforce_1x128x128_256x32x32x512_16x16_16x16_32x8x1_32x8x1_1x32x1x8_4_1x1_intrawave_v1
304,192,256,7168,234,0,12.5408,a8w8_blockscale_bruteforce_1x128x128_256x32x32x512_16x16_16x16_32x8x1_32x8x1_1x32x1x8_4_1x1_intrawave_v1
304,192,512,128,130,0,2.9565,a8w8_blockscale_bruteforce_1x128x128_256x32x32x128_16x16_16x16_8x32x1_8x32x1_1x32x1x8_4_1x1_intrawave_v1
304,192,2112,7168,1813,2,20.2793,a8w8_blockscale_bruteforce_1x128x128_256x64x32x512_16x16_16x16_32x8x1_8x32x1_1x32x1x8_4_1x2_intrawave_v1
304,192,4096,7168,2131,2,31.5071,a8w8_blockscale_bruteforce_1x128x128_256x64x64x256_16x16_16x16_16x16x1_16x16x1_1x16x1x16_4_1x4_intrawave_v1
304,192,7168,2048,2518,3,19.7947,a8w8_blockscale_bruteforce_1x128x128_256x64x64x256_16x16_16x16_16x16x1_16x16x1_1x16x1x16_4_2x2_intrawave_v1
304,192,7168,16384,2549,1,123.4511,a8w8_blockscale_bruteforce_1x128x128_256x64x64x256_16x16_16x16_16x16x1_16x16x1_1x32x1x8_4_2x1_intrawave_v1
304,192,24576,1536,3452,3,36.1751,a8w8_blockscale_bruteforce_1x128x128_256x64x128x128_16x16_16x16_8x32x1_8x32x1_1x16x1x16_4_1x2_intrawave_v3
304,224,128,512,135,1,3.4173,a8w8_blockscale_bruteforce_1x128x128_256x32x32x256_16x16_16x16_8x32x1_8x32x1_1x32x1x8_4_1x1_intrawave_v1
304,224,256,7168,234,1,12.3797,a8w8_blockscale_bruteforce_1x128x128_256x32x32x512_16x16_16x16_32x8x1_32x8x1_1x32x1x8_4_1x1_intrawave_v1
304,224,512,128,124,1,3.5853,a8w8_blockscale_bruteforce_1x128x128_256x32x32x128_8x8_16x16_8x32x1_8x32x1_1x32x1x8_4_1x1_intrawave_v1
304,224,2112,7168,415,0,22.5304,a8w8_blockscale_bruteforce_1x128x128_256x32x64x512_16x16_16x16_16x16x1_32x8x1_1x16x1x16_4_1x2_intrawave_v1
304,224,4096,7168,921,1,37.2101,a8w8_blockscale_bruteforce_1x128x128_256x32x128x256_16x16_16x16_16x16x1_16x16x1_1x16x1x16_4_1x2_intrawave_v1
304,224,7168,2048,3454,3,22.0525,a8w8_blockscale_bruteforce_1x128x128_256x64x128x128_16x16_16x16_8x32x1_8x32x1_1x16x1x16_8_1x4_intrawave_v3
304,224,7168,16384,4525,0,141.7366,a8w8_blockscale_bruteforce_1x128x128_256x64x128x128_16x16_32x32_8x32x1_8x32x1_1x16x1x16_4_1x1_intrawave_v3
304,224,24576,1536,3412,1,49.9879,a8w8_blockscale_bruteforce_1x128x128_256x64x128x128_16x16_16x16_8x32x1_8x32x1_1x8x1x32_4_1x4_intrawave_v3
304,256,128,512,234,1,3.4465,a8w8_blockscale_bruteforce_1x128x128_256x32x32x512_16x16_16x16_32x8x1_32x8x1_1x32x1x8_4_1x1_intrawave_v1
304,256,256,7168,234,1,12.6026,a8w8_blockscale_bruteforce_1x128x128_256x32x32x512_16x16_16x16_32x8x1_32x8x1_1x32x1x8_4_1x1_intrawave_v1
304,256,512,128,126,0,3.6016,a8w8_blockscale_bruteforce_1x128x128_256x32x32x128_8x16_16x16_8x32x1_8x32x1_1x32x1x8_4_1x1_intrawave_v1
304,256,2112,7168,415,3,26.1704,a8w8_blockscale_bruteforce_1x128x128_256x32x64x512_16x16_16x16_16x16x1_32x8x1_1x16x1x16_4_1x2_intrawave_v1
304,256,4096,7168,2131,1,35.8662,a8w8_blockscale_bruteforce_1x128x128_256x64x64x256_16x16_16x16_16x16x1_16x16x1_1x16x1x16_4_1x4_intrawave_v1
304,256,7168,2048,2146,3,22.106,a8w8_blockscale_bruteforce_1x128x128_256x64x64x256_16x16_16x16_16x16x1_16x16x1_1x32x1x8_4_1x2_intrawave_v1
304,256,7168,16384,2146,2,127.7301,a8w8_blockscale_bruteforce_1x128x128_256x64x64x256_16x16_16x16_16x16x1_16x16x1_1x32x1x8_4_1x2_intrawave_v1
304,256,24576,1536,5875,3,47.9756,a8w8_blockscale_bruteforce_1x128x128_256x128x64x128_16x8_16x16_8x32x1_8x32x1_1x16x1x16_4_1x4_intrawave_v3
304,288,128,512,234,2,3.9837,a8w8_blockscale_bruteforce_1x128x128_256x32x32x512_16x16_16x16_32x8x1_32x8x1_1x32x1x8_4_1x1_intrawave_v1
304,288,256,7168,234,0,12.5419,a8w8_blockscale_bruteforce_1x128x128_256x32x32x512_16x16_16x16_32x8x1_32x8x1_1x32x1x8_4_1x1_intrawave_v1
304,288,512,128,126,0,3.0112,a8w8_blockscale_bruteforce_1x128x128_256x32x32x128_8x16_16x16_8x32x1_8x32x1_1x32x1x8_4_1x1_intrawave_v1
304,288,2112,7168,415,1,27.1739,a8w8_blockscale_bruteforce_1x128x128_256x32x64x512_16x16_16x16_16x16x1_32x8x1_1x16x1x16_4_1x2_intrawave_v1
304,288,4096,7168,1439,2,42.6316,a8w8_blockscale_bruteforce_1x128x128_256x32x128x256_16x16_32x32_16x16x1_16x16x1_1x16x1x16_8_1x1_intrawave_v1
304,288,7168,2048,2146,0,25.245,a8w8_blockscale_bruteforce_1x128x128_256x64x64x256_16x16_16x16_16x16x1_16x16x1_1x32x1x8_4_1x2_intrawave_v1
304,288,7168,16384,4525,1,152.3186,a8w8_blockscale_bruteforce_1x128x128_256x64x128x128_16x16_32x32_8x32x1_8x32x1_1x16x1x16_4_1x1_intrawave_v3
304,288,24576,1536,7388,2,50.6424,a8w8_blockscale_bruteforce_1x128x128_256x128x128x128_16x16_16x16_8x32x1_8x32x1_1x16x1x16_8_1x4_intrawave_v3
304,320,128,512,234,2,4.0457,a8w8_blockscale_bruteforce_1x128x128_256x32x32x512_16x16_16x16_32x8x1_32x8x1_1x32x1x8_4_1x1_intrawave_v1
304,320,256,7168,234,2,12.6671,a8w8_blockscale_bruteforce_1x128x128_256x32x32x512_16x16_16x16_32x8x1_32x8x1_1x32x1x8_4_1x1_intrawave_v1
304,320,512,128,130,1,3.5413,a8w8_blockscale_bruteforce_1x128x128_256x32x32x128_16x16_16x16_8x32x1_8x32x1_1x32x1x8_4_1x1_intrawave_v1
304,320,2112,7168,2131,1,28.866,a8w8_blockscale_bruteforce_1x128x128_256x64x64x256_16x16_16x16_16x16x1_16x16x1_1x16x1x16_4_1x4_intrawave_v1
304,320,4096,7168,3289,3,65.2379,a8w8_blockscale_bruteforce_1x128x128_256x64x128x128_16x8_16x16_8x32x1_8x32x1_1x32x1x8_4_1x2_intrawave_v3
304,320,7168,2048,2518,2,25.1602,a8w8_blockscale_bruteforce_1x128x128_256x64x64x256_16x16_16x16_16x16x1_16x16x1_1x16x1x16_4_2x2_intrawave_v1
304,320,7168,16384,3289,1,161.8861,a8w8_blockscale_bruteforce_1x128x128_256x64x128x128_16x8_16x16_8x32x1_8x32x1_1x32x1x8_4_1x2_intrawave_v3
304,320,24576,1536,7388,2,51.7569,a8w8_blockscale_bruteforce_1x128x128_256x128x128x128_16x16_16x16_8x32x1_8x32x1_1x16x1x16_8_1x4_intrawave_v3
304,352,128,512,234,1,3.4058,a8w8_blockscale_bruteforce_1x128x128_256x32x32x512_16x16_16x16_32x8x1_32x8x1_1x32x1x8_4_1x1_intrawave_v1
304,352,256,7168,234,2,12.5141,a8w8_blockscale_bruteforce_1x128x128_256x32x32x512_16x16_16x16_32x8x1_32x8x1_1x32x1x8_4_1x1_intrawave_v1
304,352,512,128,130,0,2.973,a8w8_blockscale_bruteforce_1x128x128_256x32x32x128_16x16_16x16_8x32x1_8x32x1_1x32x1x8_4_1x1_intrawave_v1
304,352,2112,7168,3204,2,31.5926,a8w8_blockscale_bruteforce_1x128x128_256x64x64x256_16x16_32x32_16x16x1_16x16x1_1x16x1x16_4_1x1_intrawave_v1
304,352,4096,7168,6774,2,62.5053,a8w8_blockscale_bruteforce_1x128x128_256x128x64x128_16x16_32x32_8x32x1_8x32x1_1x32x1x8_8_1x2_intrawave_v3
304,352,7168,2048,3273,1,32.0083,a8w8_blockscale_bruteforce_1x128x128_256x64x128x128_16x16_16x16_8x32x1_8x32x1_1x16x1x16_4_1x4_intrawave_v3
304,352,7168,16384,3214,2,192.1829,a8w8_blockscale_bruteforce_1x128x128_256x64x64x256_16x16_32x32_16x16x1_16x16x1_1x32x1x8_8_1x1_intrawave_v1
304,352,24576,1536,7388,3,53.4955,a8w8_blockscale_bruteforce_1x128x128_256x128x128x128_16x16_16x16_8x32x1_8x32x1_1x16x1x16_8_1x4_intrawave_v3
304,384,128,512,195,1,4.007,a8w8_blockscale_bruteforce_1x128x128_256x32x32x512_16x16_16x16_16x16x1_16x16x1_1x32x1x8_4_1x1_intrawave_v1
304,384,256,7168,234,2,12.7816,a8w8_blockscale_bruteforce_1x128x128_256x32x32x512_16x16_16x16_32x8x1_32x8x1_1x32x1x8_4_1x1_intrawave_v1
304,384,512,128,144,2,3.617,a8w8_blockscale_bruteforce_1x128x128_256x32x32x128_8x8_16x16_8x32x1_16x16x1_1x32x1x8_4_1x1_intrawave_v1
304,384,2112,7168,2131,0,30.5937,a8w8_blockscale_bruteforce_1x128x128_256x64x64x256_16x16_16x16_16x16x1_16x16x1_1x16x1x16_4_1x4_intrawave_v1
304,384,4096,7168,4503,0,64.6274,a8w8_blockscale_bruteforce_1x128x128_256x64x128x128_16x8_32x32_8x32x1_8x32x1_1x8x1x32_4_1x2_intrawave_v3
304,384,7168,2048,7067,1,32.8314,a8w8_blockscale_bruteforce_1x128x128_256x128x128x128_16x16_16x16_8x32x1_8x32x1_1x16x1x16_4_1x4_intrawave_v3
304,384,7168,16384,8253,1,216.4979,a8w8_blockscale_bruteforce_1x128x128_256x128x128x128_16x8_32x32_8x32x1_8x32x1_1x16x1x16_4_1x2_intrawave_v1
304,384,24576,1536,7337,3,56.4535,a8w8_blockscale_bruteforce_1x128x128_256x128x128x128_16x16_16x16_8x32x1_8x32x1_1x8x1x32_4_1x4_intrawave_v1
304,416,128,512,234,2,3.455,a8w8_blockscale_bruteforce_1x128x128_256x32x32x512_16x16_16x16_32x8x1_32x8x1_1x32x1x8_4_1x1_intrawave_v1
304,416,256,7168,234,1,12.7388,a8w8_blockscale_bruteforce_1x128x128_256x32x32x512_16x16_16x16_32x8x1_32x8x1_1x32x1x8_4_1x1_intrawave_v1
304,416,512,128,124,2,3.0202,a8w8_blockscale_bruteforce_1x128x128_256x32x32x128_8x8_16x16_8x32x1_8x32x1_1x32x1x8_4_1x1_intrawave_v1
304,416,2112,7168,3204,0,33.5546,a8w8_blockscale_bruteforce_1x128x128_256x64x64x256_16x16_32x32_16x16x1_16x16x1_1x16x1x16_4_1x1_intrawave_v1
304,416,4096,7168,2547,3,57.662,a8w8_blockscale_bruteforce_1x128x128_256x64x64x256_16x16_16x16_16x16x1_16x16x1_1x32x1x8_4_1x1_intrawave_v1
304,416,7168,2048,7465,3,32.3227,a8w8_blockscale_bruteforce_1x128x128_256x128x128x128_16x16_16x16_8x32x1_8x32x1_1x32x1x8_8_1x4_intrawave_v3
304,416,7168,16384,2147,3,201.5561,a8w8_blockscale_bruteforce_1x128x128_256x64x64x256_16x16_16x16_16x16x1_16x16x1_1x32x1x8_8_1x4_intrawave_v1
304,416,24576,1536,7390,2,73.8695,a8w8_blockscale_bruteforce_1x128x128_256x128x128x128_16x16_16x16_8x32x1_8x32x1_1x16x1x16_4_2x2_intrawave_v3
304,448,128,512,151,1,3.4606,a8w8_blockscale_bruteforce_1x128x128_256x32x32x256_16x16_16x16_8x32x1_16x16x1_1x32x1x8_4_1x1_intrawave_v1
304,448,256,7168,234,2,12.8777,a8w8_blockscale_bruteforce_1x128x128_256x32x32x512_16x16_16x16_32x8x1_32x8x1_1x32x1x8_4_1x1_intrawave_v1
304,448,512,128,124,0,3.0362,a8w8_blockscale_bruteforce_1x128x128_256x32x32x128_8x8_16x16_8x32x1_8x32x1_1x32x1x8_4_1x1_intrawave_v1
304,448,2112,7168,2131,0,32.634,a8w8_blockscale_bruteforce_1x128x128_256x64x64x256_16x16_16x16_16x16x1_16x16x1_1x16x1x16_4_1x4_intrawave_v1
304,448,4096,7168,4668,2,66.8927,a8w8_blockscale_bruteforce_1x128x128_256x64x128x256_16x16_32x32_16x16x1_16x16x1_1x16x1x16_4_1x1_intrawave_v1
304,448,7168,2048,3214,3,33.0429,a8w8_blockscale_bruteforce_1x128x128_256x64x64x256_16x16_32x32_16x16x1_16x16x1_1x32x1x8_8_1x1_intrawave_v1
304,448,7168,16384,2147,3,194.9059,a8w8_blockscale_bruteforce_1x128x128_256x64x64x256_16x16_16x16_16x16x1_16x16x1_1x32x1x8_8_1x4_intrawave_v1
304,448,24576,1536,7388,2,71.1419,a8w8_blockscale_bruteforce_1x128x128_256x128x128x128_16x16_16x16_8x32x1_8x32x1_1x16x1x16_8_1x4_intrawave_v3
304,480,128,512,234,0,4.0341,a8w8_blockscale_bruteforce_1x128x128_256x32x32x512_16x16_16x16_32x8x1_32x8x1_1x32x1x8_4_1x1_intrawave_v1
304,480,256,7168,234,1,12.7805,a8w8_blockscale_bruteforce_1x128x128_256x32x32x512_16x16_16x16_32x8x1_32x8x1_1x32x1x8_4_1x1_intrawave_v1
304,480,512,128,130,0,3.5717,a8w8_blockscale_bruteforce_1x128x128_256x32x32x128_16x16_16x16_8x32x1_8x32x1_1x32x1x8_4_1x1_intrawave_v1
304,480,2112,7168,3214,1,36.3824,a8w8_blockscale_bruteforce_1x128x128_256x64x64x256_16x16_32x32_16x16x1_16x16x1_1x32x1x8_8_1x1_intrawave_v1
304,480,4096,7168,3518,3,65.1402,a8w8_blockscale_bruteforce_1x128x128_256x64x128x128_16x16_16x16_8x32x1_8x32x1_1x32x1x8_4_1x1_intrawave_v3
304,480,7168,2048,7473,2,33.9912,a8w8_blockscale_bruteforce_1x128x128_256x128x128x128_16x16_16x16_8x32x1_8x32x1_1x32x1x8_4_4x1_intrawave_v3
304,480,7168,16384,3214,2,219.8363,a8w8_blockscale_bruteforce_1x128x128_256x64x64x256_16x16_32x32_16x16x1_16x16x1_1x32x1x8_8_1x1_intrawave_v1
304,480,24576,1536,7390,0,76.6269,a8w8_blockscale_bruteforce_1x128x128_256x128x128x128_16x16_16x16_8x32x1_8x32x1_1x16x1x16_4_2x2_intrawave_v3
304,512,128,512,149,3,3.4614,a8w8_blockscale_bruteforce_1x128x128_256x32x32x256_8x16_16x16_8x32x1_16x16x1_1x32x1x8_4_1x1_intrawave_v1
304,512,256,7168,234,3,13.1165,a8w8_blockscale_bruteforce_1x128x128_256x32x32x512_16x16_16x16_32x8x1_32x8x1_1x32x1x8_4_1x1_intrawave_v1
304,512,512,128,130,2,3.0242,a8w8_blockscale_bruteforce_1x128x128_256x32x32x128_16x16_16x16_8x32x1_8x32x1_1x32x1x8_4_1x1_intrawave_v1
304,512,2112,7168,2146,1,35.0779,a8w8_blockscale_bruteforce_1x128x128_256x64x64x256_16x16_16x16_16x16x1_16x16x1_1x32x1x8_4_1x2_intrawave_v1
304,512,4096,7168,3269,1,73.2457,a8w8_blockscale_bruteforce_1x128x128_256x64x128x128_8x16_16x16_8x32x1_8x32x1_1x16x1x16_4_1x4_intrawave_v3
304,512,7168,2048,7067,2,34.4214,a8w8_blockscale_bruteforce_1x128x128_256x128x128x128_16x16_16x16_8x32x1_8x32x1_1x16x1x16_4_1x4_intrawave_v3
304,512,7168,16384,8253,2,231.6616,a8w8_blockscale_bruteforce_1x128x128_256x128x128x128_16x8_32x32_8x32x1_8x32x1_1x16x1x16_4_1x2_intrawave_v1
304,512,24576,1536,7107,3,71.216,a8w8_blockscale_bruteforce_1x128x128_256x128x128x128_16x16_16x16_8x32x1_8x32x1_1x32x1x8_4_1x2_intrawave_v3
304,544,128,512,176,2,4.0182,a8w8_blockscale_bruteforce_1x128x128_256x32x32x256_16x8_16x16_16x16x1_8x32x1_1x32x1x8_4_1x1_intrawave_v1
304,544,256,7168,234,3,12.9453,a8w8_blockscale_bruteforce_1x128x128_256x32x32x512_16x16_16x16_32x8x1_32x8x1_1x32x1x8_4_1x1_intrawave_v1
304,544,512,128,128,2,3.0501,a8w8_blockscale_bruteforce_1x128x128_256x32x32x128_16x8_16x16_8x32x1_8x32x1_1x32x1x8_4_1x1_intrawave_v1
304,544,2112,7168,3214,0,38.7087,a8w8_blockscale_bruteforce_1x128x128_256x64x64x256_16x16_32x32_16x16x1_16x16x1_1x32x1x8_8_1x1_intrawave_v1
304,544,4096,7168,4505,1,69.685,a8w8_blockscale_bruteforce_1x128x128_256x64x128x128_16x16_32x32_8x32x1_8x32x1_1x8x1x32_4_1x2_intrawave_v3
304,544,7168,2048,7463,0,39.7719,a8w8_blockscale_bruteforce_1x128x128_256x128x128x128_16x16_16x16_8x32x1_8x32x1_1x32x1x8_8_1x2_intrawave_v3
304,544,7168,16384,3293,3,240.0424,a8w8_blockscale_bruteforce_1x128x128_256x64x128x128_16x16_16x16_8x32x1_8x32x1_1x32x1x8_4_1x2_intrawave_v3
304,544,24576,1536,4525,1,85.3565,a8w8_blockscale_bruteforce_1x128x128_256x64x128x128_16x16_32x32_8x32x1_8x32x1_1x16x1x16_4_1x1_intrawave_v3
